,specialty,links,question,answer
632,Chủ đề nổi bật,https://edoctor.io/hoi-dap/cau-hoi-bac-si-chuyen-khoa-tiet-nieu-so-471095,"Xin chào bác sĩ, tôi đi tiểu rất nhiều lần trong ngày, việc đi tiểu thì bình thường không có đau hay khó khăn gì cả, uống nước hơi nhiều thì đi càng dữ dội, khoảng 15, 20 phút là phải đi, còn ít uống nước thì cũng đi nhiều hơn những người thường làm tôi rất khó chịu và không thoải mái khi đi xa cũng như sinh hoạt hàng ngày. Tôi có đi khám ở bệnh viện Chợ Rẫy, ở  đây có thử náu, nước tiểu, siêu âm nhưng các bác sĩ kết luận tôi không có  bị gì hết, đành phải ngậm ngùi sống như những ngày phải đi tiểu nhiều lần mà không biết phải uống thuốc gì cho hết bây giờ. Người ta đi khám không phát hiện bệnh gì thì mừng nhưng tôi thì ngược lại. Vậy mong Bs tư vấn, giúp đỡ giùm xin cảm ơn!","chào bạn! theo thông tin bạn cho biết thì về sức khỏe bạn trong giới hạn bình thường khi khám tổng quát. triệu trứng tiểu nhiều của bạn thường gặp trong 3 bệnh đó là tiểu đường , thiếu nội tiết tố cụ thể là thiếu ADH và bệnh cuối cùng là hội chứng kích ứng bàng quang. về tiểu đường bạn đã khám tổng quát chắt là không có , thiếu ADH ban phải đến khám bác sĩ chuyên về nội tiết. trong khi chờ đợi xác định tôi xin tư vấn cho ban dùng thuốc Đông Y mà tôi đã cho nhiều người giống như bạn dùng thấy có hiệu quả đó là Thuốc BỔ THẬN DƯƠNG của công ty dược BIVIPHACMA , hoặc của OPC đều được. 
chúc bạn mau khỏe"
633,Khoa tiêu hóa,https://edoctor.io/hoi-dap/cau-hoi-bac-si-chuyen-khoa-tieu-hoa-so-477890,"Xin chào bác sĩ,
Cho cháu hỏi có nên lập gia đình với người nhiễm virus viêm gan C thể không hoạt động không ạ","Chào bạn
Quyết định kết hôn hay không là ở bạn, phụ thuộc vào tình yêu, niềm tin, sự cảm thông,...giữa 2 người.
khi kết hôn, trong quá trình sinh sống 2 bạn cũng nên kiểm tra sức khỏe định kỳ, đảm bảo sức khỏe và phát hiện sớm những bất thường.
Thân mến"
634,Khoa dinh dưỡng,https://edoctor.io/hoi-dap/cau-hoi-bac-si-chuyen-khoa-dinh-duong-noi-khoa-san-phu-khoa-tieu-hoa-y-hoc-co-truyen-so-460471,"Xin chào bác sĩ,
3 tháng đầu thai kỳ có thể dùng hạt chia và ăn yến sào ko vậy ạ","Chào bạn
Hạt chia là thức ăn giàu protein và các vi chất dinh dưỡng như Canxi,phospho, Mg, kẽm, nhiều chất xơ có tác dụng nhuận trường ...  Bạn cò thai 3 tháng đầu có thể dùng được nhé, nhưng không nên dùng yến sào vi lượng đường trong yến sào hơi cao
.Chúc bạn khỏe"
635,Khoa tiêu hóa,https://edoctor.io/hoi-dap/cau-hoi-bac-si-chuyen-khoa-tieu-hoa-so-445404,"Xin chào bác sĩ,
Em bị bệnh trĩ nỗi đã khá lâu nay muốn đi cắt thì có đau không ạ","Chào bạn
Trĩ nội thì không nên cắt mà nên điều trị bằng nội khoa kết hợp chế độ ăn uống. Trĩ chỉ có chỉ định cắt khi bị trĩ ngoại và trĩ độ 3, 4 . 
Hàng ngày, bạn cần uống nhiều nước, ăn nhiều rau xanh hoa quả tươi , tránh táo bón. 
Tuy nhiên, nếu có đại tiện ra máu , bạn nên uống thêm Vitamin C liều cao, Ferovit ( Sắt ) để tránh thiếu máu
Thân mến"
636,Khoa tiêu hóa,https://edoctor.io/hoi-dap/cau-hoi-bac-si-chuyen-khoa-tieu-hoa-so-477243,"Xin chào bác sĩ,
Em bị trĩ ngoài nên ăn gì và uống gì","Chào bạn. 
Việc ăn uống đúng cách là rất cần thiết đối với người bị bệnh trĩ. Bạn cần thiết lập chế độ ăn uống như sau : 
- Uống nhiều nước mỗi ngày. Nên uống từ 1,5 đến 2l nước, nước hoa quả.
- Ăn thức ăn lỏng, dễ tiêu hóa. Ăn thực phẩm có nhiều chất xơ và nhuận tràng như chuối, cam, quýt, cà rốt , súp lơ, rau diếp cá, mồng tơi ... 
- Nếu thường đi ngoài ra máu cũng nên bổ sung thêm những thực phẩm có nhiều sắt như gan, quả óc chó ... 
- Ngoài ra tuyệt đối tránh những thực phẩm cay, nóng, chất kích thích như rượu, bia .. 
Chúc bạn chóng khỏe."
637,Khoa tiêu hóa,https://edoctor.io/hoi-dap/cau-hoi-bac-si-chuyen-khoa-tieu-hoa-so-480185,"Xin chào bác sĩ,
Có thuốc nào làm giảm triệu chứng trào ngược thực quản Hay Điều trị trào ngược thực quản không ạ","Chào bạn
Trào ngược dạ dày thực quản là tình trạng dịch vị dạ dày bị trào ngược lên thực quản do kích thích của các chất dịch trong dạ dày như HCl, pepsine, dịch mật… lên niêm mạc dạ dày gây ra. Sự tăng lượng axit dịch vị dạ dày kết hợp với hoạt động của cơ thắt dưới thực quản bị giảm sút không đủ sức ngăn dịch vị dạ dày trào ngược lên. Trào ngược dạ dày nếu xảy ra thường xuyên sẽ gây ảnh hưởng tới sinh hoạt và sức khỏe người bệnh cần được phát hiện và chữa trị kịp thời hiệu quả.
Bạn có thể tham khảo một số phương pháp giúp giảm trào ngực dạ dày thực quản tại nhà: 
1. Sử dụng lô hội:
Uống nước ép từ lô hội là một giải pháp rất đơn giản giúp bạn làm giảm các triệu chứng bệnh trào ngược dạ dày như ợ chua, ợ nóng và bạn nên uống trước khi ăn. Đặc biệt, nước ép lô hội còn giúp làm lành các tổn thương dạ dày, thực quản do bệnh gây ra rất tốt và an toàn.
2. Sử dụng trà hoa cúc:
Hàng ngày, bạn nên uống trà hoa cúc rất có lợi để chữa bệnh trào ngược dạ dày, có tác dụng thanh nhiệt giải độc cho cơ thể, trung hòa lượng axit dạ dày ngăn chặn tình trạng bị trào ngược. Từ đó làm giảm các triệu chứng của bệnh và hỗ trợ điều trị bệnh hiệu quả.
3. Uống trà gừng:
Bên cạnh uống trà hoa cúc, người bệnh có thể xen kẽ sử dụng trà gừng rất tốt cho việc chữa bệnh vì gừng có tác dụng kháng viêm, giảm đau rất tốt. Từ xa xưa trong dân gian đã dùng gừng để chữa các bệnh tiêu hóa như đầy bụng, ợ hơi,… trung hòa axit dạ dày vì thế là bài thuốc chữa trào ngược dạ dày tự nhiên và hiệu quả.
4. Ngoài việc sử dụng các phương pháp và cách chữa bệnh trào ngược dạ dày thực quản nêu trên, người bệnh cần áp dụng kèm theo các biện pháp hỗ trợ điều trị trào ngược dạ dày bao gồm điều chỉnh chế độ ăn uống hợp lý, giảm căng thẳng và thường xuyên luyện tập các bài tập phù hợp góp phần thúc đẩy hiệu quả điều trị nhanh chóng. Đó là bạn nên tăng cường bổ sung các loại rau quả tươi, các loại thức ăn tốt cho tiêu hóa; hạn chế uống rượu bia, chất kích thích, hút thuốc lá, ăn các loại đồ ăn cay nóng,… vì chúng sẽ khiến cho tình trạng bệnh phát triển nặng thêm.
5. Đồng thời bạn có thể tới các phòng khám tiêu hóa để được điều trị nội khoa: đó là sử dụng các loại thuốc chữa trị trào ngược dạ dày thực quản nhằm hạn chế và chống tiết axit dạ dày để trung hòa và ổn định dịch vị axit dạ dày ngăn tình trạng bị trào ngược. Bên cạnh đó là các loại thuốc làm giảm triệu chứng bệnh, hỗ trợ điều trị làm lành vết thương do viêm thực quản bởi axit dạ dày gây ra. Các loại thuốc chữa trào ngược thường dùng như omeprazole, lansoprazole, rabeprazole…
6. Cuối cùng, bạn có thể được điều trị bằng phương pháp phẫu thuật: các phương pháp phẫu thuật thường dùng trong chữa trị bệnh trào ngược dạ dày thực quản là phẫu thuật tạo nếp gấp đáy vị (phẫu thuật Nissen, phẫu thuật Toupet), nội soi khâu tạo hình cơ vòng dưới thực quản và phương pháp tiêm chất sinh học. Các phương pháp này được áp dụng cho các trường hợp bệnh không đáp ứng điều trị bằng nội khoa hoặc đáp ứng kém cần được chữa trị kịp thời.
Chúc bạn chóng khỏi bệnh"
638,Khoa tiêu hóa,https://edoctor.io/hoi-dap/cau-hoi-bac-si-chuyen-khoa-tieu-hoa-so-459076,"Xin chào bác sĩ,
Do yếu tố công việc nên tôi phải thường xuyên đi tiếp khách, sau đó thường hay bị đi ngoài, nếu có uống thuốc tây thì chắc là thuốc rối loạn tiêu hoá mà thôi, vậy xin hổ bác Sỹ có Men tiêu hoá nào dùng có thể trị tương đối trường hợp của tôi không? Chứ uống thuốc tây nhiều quá tôi sợ ko tốt cho bao tử
Chân thành cảm ơn Bác Sỹ","Chào bạn, 
Trường hợp của bạn là bị viêm đại tràng mãn tính. Với bệnh này chỉ khi nào cấp tính thì mới cần uống thuốc Tây y điều trị, còn mãn tính thì nên uống thuốc Đông y như Đại trang hoàn PH , Đại tràng hoàn Thái Dương...bạn có thể uống kéo dài từ 1 đến 3 tháng liên tục. Trong thời gian uống thuốc bạn cần có chế độ ăn uống hợp lý: kiêng mỡ, kiêng tanh, kiêng các chất kích thích như rượu, bia, thuốc lá... ăn uống vệ sinh đảm bảo, tránh ăn các thức ăn lạ , cần ăn từ từ để cho đại tràng thích nghi dần.
Khi đại tràng ổn định lại thì ăn uống bình thường.
Thân mến!"
639,Khoa tiêu hóa,https://edoctor.io/hoi-dap/cau-hoi-bac-si-chuyen-khoa-tieu-hoa-so-450399,"😂Xin chào bác sĩ, e hay bị đau bụng , ợ chua thì uông thuốc j ?","Chào bạn
Bạn hay đau bụng và ợ chua là dấu hiệu của đau dạ dày
Trước tien bạn cần điều chỉnh chế độ ăn: an đúng bữa, đủ chất và thức an đừng quá cứng
Chia làm nhiều bữa nhỏ, kg ăn quá no nhai kỹ
Kiêng an gia vị như ớt, tiêu, chua....giảm chất béo
Kg uong Càef hút thuốc lá
Bạn cần đi khám Bv để nội soi dạ đay và có chỉ định cụ thể nhé
Than mến"
640,Khoa da liễu,https://edoctor.io/hoi-dap/cau-hoi-bac-si-chuyen-khoa-da-lieu-than-kinh-and-co-xuong-khop-so-452602,"Xin chào bác sĩ,
Cách 3 ngày 2 chân của tôi xuất hiện những vết đỏ.Đến hôm nay những vết đỏ lan rộng lên trên đùi.Mắt cá chân bị xưng,hai đầu gối đau,mỏi.xin hỏi tôi bị bệnh gì?","Chào bạn. 
Xin được hỏi bạn những vết đỏ có gây mẩn , ngứa hay không ? 
Công việc của bạn có phải thường xuyên đi bộ, hoặc lao động nặng hay không ? 
Bạn cung cấp thêm thông tin để bác sỹ tư vấn cụ thể hơn nhé.
Thân mến."
641,Khoa thần kinh và cơ xương khớp,https://edoctor.io/hoi-dap/cau-hoi-bac-si-chuyen-khoa-than-kinh-and-co-xuong-khop-so-482611,"Xin chào bác sĩ, hiện nay tôi đau lưng dưới nhưng chệch về bên phải và kéo dọc xuống bắp chân khi nằm thẳng rất buốt khiến tôi cảm thấy rất khó chịu tôi phải làm sao. Xin nhờ bác sĩ tư vấn giúp tôi xin cảm ơn","Chào bạn!
Tình trạng mô tả của bạn có thể bạn do đau thần kinh tọa có thể do  thoát vị đĩa đệm (thường gặp nhất là đĩa đệm L4-L5 hoặc L5-S1 gây chèn ép rễ L5 hoặc S1 tương ứng); trượt đốt sống; thoái hóa cột sống thắt lưng gây hẹp ống sống thắt lưng. Các nhóm nguyên nhân do thoái hóa này có thể kết hợp với nhau. Các nguyên nhân hiếm gặp hơn: Viêm đĩa đệm đốt sống, tổn thương thân đốt sống (thường do lao, vi khuẩn, u), chấn thương, tình trạng mang thai…
Tùy nguyên nhân mà có những điều trị khác nhau có thể gồm:
- Giảm đau và phục hồi vận động nhanh :Nằm giường cứng, tránh võng hoặc ghế bố, tránh các động tác mạnh đột ngột, mang vác nặng, đứng, ngồi quá lâu. 
- Điều trị nội khoa với những trường hợp nhẹ và vừa 
- Can thiệp ngoại khoa khi có những biến chứng liên quan đến vận động, cảm giác.
Bạn nên đến các cơ sở y tế chuyên khoa để làm thêm các khảo sát hình ảnh XQ cột sống thẳng nghiêng, MRI cột sốt thắt lưng để có chẩn đoán chính xác và có hướng điều trị phù hợp. 
Thân mến."
642,Khoa thần kinh và cơ xương khớp,https://edoctor.io/hoi-dap/cau-hoi-bac-si-chuyen-khoa-than-kinh-and-co-xuong-khop-so-442865,"Xin chào bác sĩ,
Cho em hỏi về bệnh đau dây thần kinh liên sườn có nguy hiểm không? Chữa trị như thế nào?","Chào cháu, 
Bệnh đau dây thần kinh liên sườn không gây nguy hiểm, cháu có thể điều trị bằng cách : 
- Mỡ Voltaren, xoa bóp tại chỗ ngày 3 lần ( sáng- trưa- chiều)
- Uống Magie B6 ngày 2 viên/2 lần.
- Vitamin 3B ngày 4 viên/ 2 lần.
Uống trong 10 ngày.
Thân mến!"
643,Khoa nội,https://edoctor.io/hoi-dap/cau-hoi-bac-si-chuyen-khoa-noi-khoa-than-kinh-and-co-xuong-khop-so-473708,"Xin chào bác sĩ,
Cháu hay bị trúng gió mùa lạnh hầu như sáng cháu thức dậy cảm giác chóng mặt đau đầu sau khi beo gió cháu thấy bình thường trở lại bác sĩ cho cháu hỏi là cách phòng tránh và điều trị triệu trứng trên
Cháu xin cám ơn","Chào Em!
- Em đã đi kiểm tra tim mạch và huyết áp chưa.
- Em nên có chế độ dinh dưỡng và thể dục thể thao hợp lý để cơ thể có sức đề kháng tốt.
- Nếu sáng trời lạnh thì em nên có bài tập vận động nhẹ nhàng trên gường khi thức dậy rồi mới ngồi dậy.
- Em duy trì một thời gian kết hợp ăn ngủ hợp lý mà tình trạng trên vẫn không thay đổi thì em nên đi khám Nội Khoa ở bệnh viên tại nơi em sống.

Chúc em vui và sống khỏe!"
644,Khoa thần kinh và cơ xương khớp,https://edoctor.io/hoi-dap/cau-hoi-bac-si-chuyen-khoa-than-kinh-and-co-xuong-khop-so-472940,"Xin chào bác sĩ, bệnh alzeimer có chữa khỏi không?","Chào bạn,
Bệnh Alzheimer là hiện tượng thoái hóa não bộ không có khả năng phục hồi ở người cao tuổi, gây nên chứng mất trí và sa sút trí tuệ. Vì vậy chỉ có thể có những biện pháp phòng tránh khi có những dấu hiệu sớm của bệnh do còn nhiều hạn chế trong điều trị bệnh Alzheimer.
Ngoài ra vai trò của người thân trong gia đình rất quan trọng trong việc phòng và điều trị bệnh. Ở giai đoạn đầu, người bệnh có thể tự khắc phục tình trạng suy giảm trí nhớ của mình bằng cách lập bảng ghi nhớ, ghi vào sổ tay và nhờ mọi người xung quanh nhắc nhở.Ngoài ra, bệnh nhân cần thay đổi lối sống bằng cách thực hiện các biện pháp giảm căng thẳng (câu cá, nghe nhạc, tập yoga), đi dạo thường xuyên, làm các bài tập trí nhớ (chơi đố ô chữ, sudoku)… Khi bệnh đã chuyển sang giai đoạn nặng thì người bệnh rất dễ rơi vào trạng thái nguy hiểm như bị trầm cảm, đi lạc, thậm chí muốn tự tử… nên rất cần sự giám sát liên tục của người thân. Nên cho bệnh nhân đeo vòng có ghi rõ địa chỉ, số điện thoại để dễ tìm khi người bệnh đi lạc.
Thân mến!"
645,Khoa thần kinh và cơ xương khớp,https://edoctor.io/hoi-dap/cau-hoi-bac-si-chuyen-khoa-than-kinh-and-co-xuong-khop-so-486198,"Xin chào bác sĩ,
Rối loạn thần kinh cảm xúc chữa như nào ạ 
Năm nay cháu 20 tuổi","Chào bạn,
Đây là bệnh cần điều trị lâu dài, cần theo dõi thường xuyên và phải điều trị bằng thuốc đặc hiệu vì vậy bạn nên đến khám tại chuyên khoa Thần kinh - Tâm thần để bác sỹ có chỉ định điều trị hợp lý.
Thân mến!"
646,Khoa thần kinh và cơ xương khớp,https://edoctor.io/hoi-dap/cau-hoi-bac-si-chuyen-khoa-than-kinh-and-co-xuong-khop-so-466543,"Xin chào bác sĩ,
Thường ngày cứ vào lúc buổi chiều khi tắm xong , hai bên phải bắp vê bị ngứa liên tục và thường xuyên như vậy","Chào bạn!
Tình trạng của bạn có thể là dị ứng, có thể là do với xà bông, hay sữa tắm , dầu gội đầu...
Bạn có thể thay đổi sang loại khác. 
Nếu tình trạng ngứa này vẫn không thuyên giảm bạn nên đến các cơ sở y tế chuyên khoa da liễu để có chẩn đoán chính xác và điều trị thích hợp.
Thân mến,"
647,Khoa sản phụ,https://edoctor.io/hoi-dap/cau-hoi-bac-si-chuyen-khoa-san-phu-khoa-so-442442,,
648,Khoa da liễu,https://edoctor.io/hoi-dap/cau-hoi-bac-si-chuyen-khoa-da-lieu-san-phu-khoa-so-456644,"Em chào bác sĩ. 
Khoảng hơn 1 tháng trước em bị thuỷ đậu. Khoảng 2 tuần nay em chậm kinh và đi khám bác sĩ nói em có thai, em bé được 5 tuần tuổi. Tức là trong những ngày đầu em bị thuỷ đậu thì em có em bé. Em đọc 1 số bài viết nói về mẹ khi mang thai bé mà bị thuỷ đậu thì từ tuần thứ 8 trở đi rất nguy hiểm có thể gặp các biến chứng. Nhưng em có em bé lúc đó được tầm 2,3 ngày tuổi thì có ảnh hưởng gì tới em bé hay không ạ? Liệu khi em giữ em bé lại thì sau này có bị ảnh hưởng hay gặp các biến chứng hay nguy hiểm gì không? Mong bác sĩ tư vấn giúp em. Em cảm ơn","Chào bạn.
Nếu bà mẹ bị thủy đậu trong giai đoạn sớm của thời kỳ mang thai (tuần thứ 8 - 20) thì bào thai có nguy cơ bị dị tật bẩm sinh. Tuy nhiên về trường hợp của bạn, không thể khẳng định được thai có gặp vấn đề gì hay không? Chính vì vậy bạn cần đi khám, làm các xét nghiệm sớm, theo dõi thai thường xuyên nhé.
Thân mến."
649,Khoa sản phụ,https://edoctor.io/hoi-dap/cau-hoi-bac-si-chuyen-khoa-san-phu-khoa-so-452046,"Xin chào bác sĩ,
Em năm nay 26t đã có chồng và con,gần đây vùng kín e thường bị ngứa và ra khí hư nhiều e cũng đã đi khám 2 lần, 1 lần bs cho thuốc e uống ko hết mà càng nặng hơn..lần sau e ik khám bệnh viện khác uống hết nhưng sau khi qh thì lại bị lại..e đã áp dụng các phương pháp tự nhiên như rửa lá trầu và uống 1 tép tỏi mỗi ngày thì hiện tượng ngứa và ra dịch có mùi hết nhưng mỗi lần qh e lại rất đau rát và sưng...E phải làm sao ạ??
cám ơn bác sĩ","Chào bạn, 
Khi bị viêm nhiễm cần điều trị dứt điểm, ngoài ra trong và sau thời gian điều trị cần chú ý giữ vệ sinh   sạch sẽ và kiêng khem trong sinh hoạt vợ chồng. Sau khi chữa trị, nhiều phụ nữ bị tái phát lại chỉ trong thời gian ngắn. Tuy nhiên, thực chất, đa phần là do nhiều yếu tố khách quan.
Nguyên nhân thường gặp nhất của bệnh viêm nhiễm phụ khoa chính là yếu tố vệ sinh kém dẫn đến vi khuẩn tấn công và gây nhiễm trùng âm hộ – âm đạo. Đối với bên ngoài, cần rửa sạch âm hộ mỗi ngày, sau đó dùng khăn sạch lau khô trước khi mặc quần lót . Chú ý nên dùng quần lót cotton thoáng và mềm, không nên mặc đồ bó sát.Có thể do việc vệ sinh thường xuyên khiến cho âm đạo bị khô khiến cho bạn bị đau rát và sưng khi quan hệ.
Ngoài ra nên hạn chế quan hệ vợ chồng trong thời gian này để đảm bảo chữa trị được dứt điểm, hiệu quả, nếu có quan hệ tốt nhất nên dùng bao cao su. Không thể loại trừ nguyên nhân khiến viêm nhiễm quay trở lại là do bị lây từ chồng. Vì vậy chồng bạn cũng nên đi khám để loại trừ nguyên nhân này, đảm bảo cho việc chữa trị được nhanh chóng.
Có những trường hợp trong lần viêm nhiễm sau, nhiều người lầm tưởng mình bị lại nhưng thực tế lại là một bệnh khác. Vì vậy nếu bạn đi khám Phụ sản định kỳ được là tốt nhất để theo dõi được tình trạng sức khỏe của mình.
Thân mến!"
650,Khoa sản phụ,https://edoctor.io/hoi-dap/cau-hoi-bac-si-chuyen-khoa-san-phu-khoa-so-470465,"Xin chào bác sĩ,toi 23t, từ giữa chu kì đến cuối chu kì...tôi bị ra chất nhờn màu trắng đục đặc,không có mùi hôi,tôi mới có chồng.bác sĩ cho tôi hỏi tôi có bị gì không....nếu có xin bác sĩ chỉ cách chữa trị,vì tôi ngại đi khám...xin cám ơn","Chào bạn
Có thể bạn đã bị viêm âm đạo do quan hệ không sạch sẽ. Nếu ngại đi khám, bạn có thể đặt thuốc ( Polyginat , mỗi ngày đặt 1 viên trong 7 ngày ). Trong những ngày đặt thuốc cần kiêng quan hệ. Lưu ý rửa tay sạch sẽ trước khi đặt thuốc nhé, có thể sát khuẩn ngón tay bằng cồn 70 độ. 
Thân mến"
651,Khoa sản phụ,https://edoctor.io/hoi-dap/cau-hoi-bac-si-chuyen-khoa-san-phu-khoa-so-485058,"Xin chào bác sĩ,
Cho e hỏi là quanh núm vú của e có đôi hạt màu trắng nhỏ li ti,khi nặn ra thì có màu trắng giống như mụn trắng,không đau,không ngứa,vùng da vẫn bình thường.e có bị làm sao không ạ.e cảm ơn!","Chào em gái , 
Quanh núm vú có những hạt thường được gọi là hạt mongomery.  Những hạt này bình thường vẫn có quanh núm vú, thường nhỏ, màu trắng, bên trong thường có nhân giống như trứng cá. Khi em có thai, những hạt này sẽ to lên và chuyển màu đen. Nhưng tất cả các hiện tượng đó đều là sinh lý bình thường . Vì vậy em không cần phải lo lắng nhé 
Thân mến"
652,Khoa sản phụ,https://edoctor.io/hoi-dap/cau-hoi-bac-si-chuyen-khoa-san-phu-khoa-so-462046,"Dạ bác sĩ cho em hỏi, em mới trễ kinh 2 ngày, thử que 1 vạch đậm 1 vạch mờ, người thân biết thì khuyên em theo 2 trường phái: 
1/ Đi khám ngay
2/ Đợi trễ 10 bữa nữa tháng hãy đi, giờ nhỏ xíu có thấy gì đâu mà đi
Em không biết nghe theo bên nào, mong được bác sĩ tư vấn giúp
Dạ còn một chuyện nữa là theo em tham khảo sách vở thì có nói khi mang thai sẽ có một ít máu báo nhưng em theo dõi hoài cũng chưa thấy.
 Em cảm ơn","Chào bạn,
Hiện tượng máu báo là dấu hiệu mang thai thường gặp ở thời gian mới mang thai, tuy nhiên thời gian xuất hiện dấu hiệu này không ai giống ai, có thể sớm ở người này, muộn ở người kia, người có , người không. Bạn không nên quan trọng quá vấn đề này.
Bạn nên để thêm 5 ngày nữa, bạn thử lại 1 lần nữa, nếu vẫn hiện 2 vạch thì bạn chờ thêm 10 ngày nữa hãy đi khám, lúc đó siêu âm xác định xem thai vào tử cung chưa là chính xác nhất.
Thân mến!"
653,Khoa sản phụ,https://edoctor.io/hoi-dap/cau-hoi-bac-si-chuyen-khoa-san-phu-khoa-so-477415,"Xin chào bác sĩ 
Làm sao để biết thai đã được phá khi uống xong thuốc tránh thai ạ?? 
E và Ng yêu có sờ soạng và đã lỡ  xuất tinh làm ướt quần lót của e, nhưng e chưa thay 
Vậy nguy cơ có thai có cao k ạ??  Mong bs hồi âm sớm","Uống thuốc tránh thai không có tác dụng phá thai nhé bạn. Sau khi uống thuốc phá thai nội khoa thì dấu hiệu cho biết có thể thai đã ra là bệnh nhân ra một khối máu,sau khi ra khối máu thì bụng bớt đau. siêu âm không còn thấy túi thai trong tử cung mới là dấu hiệu gần như chính xác thai đã ra      Trương hợp xuất tinh dính vào quần lót thì khả năng có thai rất thấp"
