,specialty,links,question,answer
208,Chủ đề nổi bật,https://edoctor.io/hoi-dap/beo-phi-co-anh-huong-den-kha-nang-sinh-ly,Chào bác sĩ ạ. Mình hiện đang bị béo phì. Dạo gần đây mình đọc được 1 số thông tin về việc gây giảm khả năng sinh sản sinh lý. Bác sĩ có thể giúp mình hiểu rõ cặn kẽ các tác hại của béo phì về vấn đề này không ạ. Cảm ơn bác sĩ,"Chào em!
    Bệnh béo phì thường gắn liền với sự lười biếng và ít vận động. Điều này có thể liên quan đến đời sống tình dục của họ. Ở nam giới, tác hại của bệnh béo phì cũng làm giảm đáng kể thời gian họ có thể duy trì được sự cương cứng, do đó khả năng đạt khoái cảm của họ cũng kém hơn so với người khác.
  -  Những người đàn ông béo phì thường bị rối loạn chức năng cương dương và bất lực với tỷ lệ cao. Các vấn đề liên quan đến béo phì như cholesterol cao, tăng huyết áp, tiểu đường ngăn chặn máu chảy đến các bộ phận của cơ thể và không loại trừ dương vật, do đó gây ra các vấn đề với sự cương cứng.
-  Ở nam giới, bệnh béo phì liên quan trực tiếp đến vô sinh vì nó ảnh hưởng đến tinh trùng. Nghiên cứu đã chỉ ra rằng những người đàn ông tiêu thụ một chế độ ăn uống gây béo có chất lượng tinh trùng thấp hơn đàn ông bình thường. Cụ thể, những người đàn ông thường xuyên tiêu thụ nhiều chất béo bão hòa có số lượng tinh trùng thấp hơn 35% và nồng độ tinh trùng thấp hơn 38% so với những người đàn ông có thể trạng bình thường và có chế độ ăn lành mạnh.
Sau dịch nếu có điều kiện em đến khám nam khoa để được tư vấn thêm nhé.
Thân chào!"
209,Chủ đề nổi bật,https://edoctor.io/hoi-dap/tinh-trang-kinh-nguyet-bat-thuong-co-nguy-hiem,"Em là nữ, 23 tuổi. E có muốn hỏi các bác sĩ về phụ khoa. Gần đây, chu ký kinh nguyệt của em kéo dài từ 26/7 -30/7.  Tuy nhiên, đến ngày 9/8 e có hiện tượng đau bụng, kinh nguyệt trở lại kèm theo chảy máu nhưng ít đến ngày 12/8 thì kết thúc. chu kì tiếp theo của e bắt đầu từ ngày 26/8 - 30/8, cho đến khoảng 1 tuần sau e có khi hư màu nâu đỏ như máu trong kì kinh nguyệt, không có các hiện tượng khác kèm theo. Mong bác sĩ giải đáp về tình trạng của em và cho em xin lời khuyên ạ. Em cảm ơn ạ","Chào bạn,
Theo chia sẻ của bạn, có sự xuất hiện lượng ít kinh nguyệt giữa chu kỳ. Và chỉ xuất hiện trong vòng 1 tháng trở lại đây.

Có nhiều nguyên nhân dẫn đến sự bất thường này: có thể do thuốc, do bất thường chức năng ( có thể u xơ tử cung là 1 ví dụ), kinh nguyệt tồn đọng,...

 Để xác định được nguyên nhân, thì những chia sẻ của bạn là chưa đủ, mà cần có những thiết bị máy móc để kiểm tra. Vậy nên bạn cần đến cơ sở y tế uy tín để thăm khám bạn nhé.

Trước tiên, vẫn theo dõi chu kỳ của bạn và ghi nhận lại những bất thường, sau đó chờ hết kinh khoảng 5 - 7 ngày thì có thể đi khám bạn nhé.

Thân gửi bạn!"
210,Chủ đề nổi bật,https://edoctor.io/hoi-dap/muon-cat-tuyen-mo-hoi-nen-lam-o-dau,"Xin chào bác sĩ.
Bác sĩ tư vấn giúp tôi, em gái tôi muốn cắt tuyến mồ hôi nách, bằng phương pháp tiểu phẫu, hay nội soi? Thời gian thực hiện bao lâu? Sau khi cắt xong có hết vĩnh viễn không? Ngoài ra còn phương pháp nào điều trị tốt nhất? Chi phí khoảng bao nhiêu? Tại Tp HCM Bệnh Viện nào tốt nhất ? 
Xin chân thành cám ơn bác sĩ.","chào bạn, hiện nay để điều trị tăng tiết mồ hôi tay người ta sẽ tiến hành nội soi cắt hạch giao cảm ngực điều trị tăng tiết mồ hôi. Tuy nhiên khi giảm tiết mồ hôi ở nách sẽ gây tăng tiết mồ hôi ở nơi khác như ngực, chân,….
Đây là phương pháp hiệu quả và có hiệu quả ngay tức thì hết tăng tiết mố hôi ngay tức thì ở nách.
Thời gian mổ tuỳ theo phẫu thuật viên mà dao động khoãng 45 phút-90 phút. 
Chi phí phẫu thuật tuỳ cơ sở mà có giá khác nhau nên cái này bác sĩ không thể tư vấn cho bạn được. Như cơ sở bác sĩ đang làm là 11 triệu. 
Đây là phẫu thuật phổ biến nên hầu hết các bệnh viện đều làm được. bạn có thể lựa chọn bất cứ cơ sở nào mà bạn tin tưởng.
Thân mến!"
211,Chủ đề nổi bật,https://edoctor.io/hoi-dap/phat-hien-cuc-u-ben-nguc-phai-sau-sinh-con-5-thang,"Chào bác sĩ
Em năm nay 29 tuổi nữ
Vừa mới sinh con được 5 tháng
Gần đây e phát hiện phía bên trên vú phải có nổi 1 cục cứng, lúc đầu em tưởng bị tắc tia sữa nên có massage nhưng không tan vẫn cứng
Do tình hình dịch nên e chưa đi siêu âm được.
Bác sĩ cho e hỏi trường hợp của e có nguy hiểm không ạ?
Em cảm ơn ạ.
Em xin đính kèm vị trí bị nổi cục ạ
","Chào bạn!
1. Trường hợp của bạn Bác sỹ không thể khẳng định là có nguy hiểm hay không nguy hiểm vì chưa đủ để trả lời.
2. Tốt nhất bạn nên đi khám khi có thể tại cơ sở y tế để được thăm khám, làm siêu âm tuyến vú cũng như các cận lâm sàng cần thiết khác đủ để chẩn đoán.
Chúc bạn sức khỏe! "
212,Chủ đề nổi bật,https://edoctor.io/hoi-dap/nen-cho-em-be-bu-nhu-the-nao-de-huong-tron-sua-dau-va-sua-cuoi,"Em chào Bác!
Bác vui lòng chỉ giúp em để em có thể cho con bú tốt nhất có thể ạ. Em được biết sữa đầu và sữa cuối nhưng em không biết cho bé bú như thế nào để trọn được sữa cuối ạ. Giờ em cho bé bú 1 bên đến khi nào bé k bú nữa như vậy là bé đã bú được sữa cuối chưa ạ? Nếu đang bú 1 bên dang dở rồi bú sang bên khác sau đó quay lại bên bú trước như vậy là bé bú sữa cuối hay sữa mới vậy Bác? Bé em được 2 tháng tuổi nặng 4,8kg ạ. Cám ơn Bác.","chào mẹ bé
nếu mẹ muốn để bé bú cả sữa đầu và sữa cuối thì mẹ bé nên để bé bú hoàn toàn 1 bên cho tới khi vú bên đó xẹp hoàn toàn mà bé vẫn chưa no thì mới sang vú còn lại bú nhé"
213,Chủ đề nổi bật,https://edoctor.io/hoi-dap/nguoi-co-tien-su-tieu-duong-co-dau-hieu-tieu-gat-nen-lam-gi,"Chào bác sĩ tôi 65 tuổi nam bị tiểu đường uống thuốc được 5 tháng bị cách li không đi tái khám được mua thuốc về uống Co Miaryl 2mg Metformin500mg uống ngày 2 viên hết thuốc mua không có đúng hiệu Metformin Stella 1000mg uống ngày một viên có được không? Dạo gần đây tôi bị tiểu gắt mắc tiểu nhưng không tiểu được đứng lâu lắm mới được nhưng 1 lát sau phải đi nữa, đi nhiều lần lắt nhắt lại khó đi. Không biết bị gì xin bác sĩ tư vấn cho uống thuốc gì cảm ơn bác sĩ.","Chào bác, bác nên tiếp tục duy trì thuốc tiểu đường của bệnh viện kê trước khi cách ly và không nên tự ý đổi thuốc khác.Với metformine bác nên uống sau ăn trưa hoặc tối nhé. Ở tuổi bác đi tiểu nhiều về đêm hoặc tiểu không hết bãi nước tiểu, tia nước tiểu yếu bác thì có thể bác bj phì đại tuyến tiền liệt. Bác nên đến chuyên khoa Ngoại tiết niệu khám nha. Nếu tình trạng dịch khiến bác chưa đi khám được bác có thể liên hệ trực tiếp bấc sĩ edoctor để được hỗ trợ nhé. Chúc bác nhiều sức khỏe!"
214,Chủ đề nổi bật,https://edoctor.io/hoi-dap/chich-vaccine-covid-19-mui-1-sau-bao-lau-thi-co-the-tiem-thuoc-tro-phoi-thai-nhi,"Xin chào Bác sĩ, E=em tên Nguyễn Thị Hạnh, 28 tuổi, bầu 32 tuần, em mới chích vắc-xin mũi 1, bác sĩ cho em hỏi sau bao lâu thì em được chích thuốc trợ phổi thai nhi ạ? Trước em có bị sảy thai đôi 22tuần ạ. Mong bác sĩ trả lời giúp em với ạ. Em cảm ơn ạ","chào bạn. bạn không nói cụ thể là bạn mới chích vacxin mũi 1 là loại văcxin gì ( với tình hình thực tế hiện tại bs có thể hiểu bạn chích vacxin phòng covid) tuy nhiên cho dù bạn chích vacxin gì đi chăng nữa việc tiêm trợ phổi cho thai cũng phải theo chỉ định của bác sĩ nếu bạn có biểu hiện của dọa sinh non. việc điều trị trợ phổi cho thai nhi hiện nay không còn được sử dụng rộng rãi như trước nữa vì theo nghiên cứu nó là con dao hai lưỡi có mặt tốt và mặt xấu lên thai. do vậy nếu bạn có dấu hiệu của dọa sinh non như đau bụng cơn, ra dịch hồng âm đạo, rỉ ối... bạn nên đến bệnh viện để điều trị được tốt nhất. chúc bạn an toàn và sức khỏe trong mùa dịch này"
215,Chủ đề nổi bật,https://edoctor.io/hoi-dap/xet-nghiem-men-g6dp-o-dau-chi-phi-nhu-the-nao,Em chào bác sĩ. em là nữ sinh năm 1989.  Gia đình em có 3 chị em gái thì lúc mới sinh đều bị vàng da. Chị gái thứ hai có đẻ con trai xét nghiệm bị thiếu men g6dp. Em chưa có gia đình nhưng em muốn xét nghiệm xem mình có bị thiếu men g6dp không thì xét nghiệm ở đâu? Và chi phí khoảng bao nhiêu ạ? Và việc thiếu men g6dp có ảnh hưởng đến việc tiêm phòng covid-19 không ạ? Em xin cảm ơn ạ,"Chào em !
- Thiếu men G6PD là bệnh di truyền phổ biến, do thiếu men này khiến tế bào hồng cầu hoạt động không bình thường, người bệnh dễ dị ứng khi ăn đậu tằm hoặc sử dụng một số dược hóa chất có khả năng oxy hóa. Con trai dễ mắc bệnh hơn con gái.
- Xét nghiệm em có thể làm ở Bệnh viện huyết học, Bệnh viện Vinmec, Trung tâm chẩn đoán y khoa Hòa hảo, Bệnh viện Từ dũ..chi phí sẽ phụ thuộc vào bác sỹ thăm khám đưa ra yêu cầu cụ thể từng trường hợp.
-Về bệnh nhân thiếu men G6PD không nằm trong chống chỉ định khi tiêm phòng Covid19 em nhé, nhưng khi đến khám sàng lọc trước tiêm ngừa bác sỹ sẽ thăm khám trực tiếp để có yêu cầu cần thiết của từng trường hợp thực tế hiện tại đối với người bệnh.
Thân mến!"
216,Chủ đề nổi bật,https://edoctor.io/hoi-dap/bi-noi-me-day-co-duoc-tiem-vaccine-khong,,
217,Chủ đề nổi bật,https://edoctor.io/hoi-dap/hay-bi-met-moi-suy-nhuoc-co-the-co-nen-truyen-nuoc,"Tôi năm nay 65 tuổi, giới tính nữ. Tôi bị đuối sức, suy nhược cơ thể, người  rất mệt mỏi, chân bị tê, giờ tôi có thể truyền nước được không . Mong bác  sĩ giải đáp giùm ạ.","chào chị, chị mệt, ăn kém thì truyền nước được, nhưng trong tình hình hiện nay chị nên uống nước đầy đủ, ăn chế độ tăng đạm, xoa bóp tay chân để điều hoà khí huyết, ngủ đủ 6-7h, thư giãn chị nhé."
218,Chủ đề nổi bật,https://edoctor.io/hoi-dap/nen-dung-thuoc-gi-de-giam-ho-cho-nguoi-co-tien-su-mac-tieu-duong-huyet-ap,"Chào BS, ba tôi 84 tuổi huyết áp cao, tiểu đường. Thường xuyên ho khan, ho đã vài năm nay, có mua thuốc nước, thuốc viên để uống nhưng vẫn chưa giảm ho. Trong thời gian chưa đi khám bệnh được, mong BS tư vấn thuốc uống cho đỡ con ho. (ba tôi thường xuyên ăn chuối, không biết có ảnh hưởng đến ho không) 
Rất mong hồi âm của BS."," Chào bạn!
 Ho khan là loại ho khó xác định nguyên nhân như chất gây ra kích ứng là gì hay do môi trường hay do thực phẩm để phòng tránh.
  Bởi vậy ho khan là tình trạng bệnh khó điều trị. Tuy nhiên ho khan đa số các trường hợp là do yếu tố kích ứng đường hô hấp. 
  Những biện pháp thực hiện để giảm ho :
- Uống đủ nước: là một cách thức vô cùng đơn giản và hiệu quả. Ưu tiên uống nước ấm, nóng thay vì uống nước lạnh.
- Bổ sung lượng vitamin C sẽ giúp tăng cường miễn dịch, nâng cao sức đề kháng và chống lại các loại virus thông thường. Bạn có thể cung cấp lượng vitamin C từ các loại rau củ hàng ngày trong các bữa ăn như súp lơ xanh, cà chua,… hay các loại hoa quả giàu vitamin như cam, chanh, dứa,…
- Sử dụng mật ong tự nhiên cũng sẽ là một biện pháp vô cùng hiệu quả đối với việc cải thiện và điều trị ho khan. 
- Không ở phòng máy lạnh, không dùng quạt suốt đêm.
- Uống Siro ho Prospan cho người lớn.
Thân chào!"
219,Chủ đề nổi bật,https://edoctor.io/hoi-dap/thuong-xuyen-te-bi-chan-tay-nen-xu-ly-the-nao,"Chào bác sĩ, em là Tấn Anh, nam, 28 tuổi, hiện đang sống và làm việc ở tp.hcm. Em bị tê bì chân tay từ tháng 04.2021, đã đi khám tại bệnh viên gia định, bác sĩ chuẩn đoán mắc bệnh hội chứng ống cổ tay. Em uống thuốc được tầm 2 tháng tới tháng 6 bị dịch bệnh nên chưa thể đi tái khám được. Hiện tại tay chân của em vẫn bị tê, nhất là vài buổi tối khi ngủ, tê cứng tay, như kiến đốt, mất cảm giác, đôi khi còn bị chảy mồ hôi tay. Cho em hỏi hiện tại thì với tình trạng của em có nguy hiểm không ạ, hiện tại dịch bệnh chưa đi khám được thì em nên làm gì để cải thiện triệu chứng trên ạ. Em cám ơn bác sĩ.","Chào bạn, có nhiều nguyên nhân gây ra hiện tượng tê tay: chèn ép hoặc thoát vị đĩa đệm cột sống cổ, hội chứng cơ sấp tròn, hội chứng ống cổ tay,… Hầu hết các bệnh lý này là do chèn ép thần kinh ở các vị trí khác nhau. 
Nếu như bạn đã từng được chẩn đoán hội chứng ống cổ tay thì tuỳ theo mức độ tổn thương hiện tại mà bác sĩ có thể cho bạn uống thuốc hoặc phẩu thuật. 
Với tình hình sài gòn hiện tại bạn có thể mua lại đơn thuốc đó để uống trước, khi nào dịch bệnh ổn định bạn đi khám lại xem đã đến giai đoạn cần phải phẫu thuật chưa bạn nhé.
Bệnh lý này không cấp cứu, phẫu thuật sớm nhất khi điều kiện cho phép là được bạn nhé"
220,Chủ đề nổi bật,https://edoctor.io/hoi-dap/me-em-bi-mat-ngu-trien-mien-do-stress-em-nen-lam-gi-de-giup-me,"Mẹ em năm nay 46 tuổi , tầm 1 tuần nay khó ngủ ( có đêm ngủ được 6 tiếng , có đêm 3-4 tiếng ) trưa thì không ngủ được nhưng người hay buồn ngủ thì mình có thể cải thiện tình trạng này bằng cách nào không ạ 
Mẹ em có tập thể dục mỗi ngày 45-60phut đi bộ kết hợp yoga nhẹ & phơi nắng sáng 
Mẹ em có biểu hiện như : stress ( hay lo lăng , suy nghĩ hơi tiêu cực và đầu hay bị căng thẳng). Cách nay 1 tuần mẹ em có đi khám tổng quát thì có bị nhiễm Hp & viêm xoang nhẹ 
Có đang dùng thuốc điều trị của bệnh viện & uống thêm hoạt huyết nhất nhất (trước đó uống mimosa để cải thiện giấc ngủ nhưng không có kết quả) nhưng vì không ngủ được nên mẹ rất lo lắng và ăn uống không ngon miệng, các bác sĩ cho em xin ý kiến với ạ. ","Chào bạn. 
Qua lời kể thì mẹ bạn bị Rối loạn lo âu/ Rối loạn giấc ngủ, đây là 2 bệnh phổ biến trong mùa covid này. Ta càng ở nhà nhiều, càng thấy bế tắc, chật chội, hoặc phải đọc những thông tin tiêu cực từ mùa dịch.
vậy thì ta làm gì?
không dùng thuốc: cô đã tập thể dục, yoga, vậy là rất tốt. Có thể kết hợp thêm bài tập hít thở (hay gọi là thiền), chỉ cần làm 3 phút mỗ tối, chú ý vào hơi thở của mình, tịnh tâm. Ăn uống đầy đủ, không kiêng cữ.
Đọc sách, truyện tiểu thuyết, hạn chế đọc các tin tức tiêu cực hiện nay.
Dùng thuốc: bạn có thể vào box chat để gặp BS, để BS hỏi thêm 1 số bệnh nền và triệu chứng khác để kê toa nhé.
Thân mến!"
221,Chủ đề nổi bật,https://edoctor.io/hoi-dap/dung-thuoc-ngu-thuong-xuyen-co-bi-giam-tri-nho,"Chào Bác sĩ
Em muốn hỏi về trường hợp của Mẹ em, năm nay 52 tuổi đã dùng thuốc an thần được 2 năm  (ở  bệnh viện Tâm Thần  TPHCM). Mẹ em chỉ bị mất ngủ, nguyên nhân em khai thác được là do mẹ em suy nghĩ quá nhiều. Khoảng 3 tháng  trở lại đây thì mẹ em thăm khám ở bệnh viện ĐH Y Dược TPHCM và đc kê thuốc, mẹ e uống hết tháng thứ 2 thì qua tháng  thứ 3, BS bên đó giảm thuốc. Cụ thể hiện tại mẹ em uống  sáng 1 viên  tanakann, chiều  1 viên  tanakan  và tối thì 1 viên amitruptylin  25mg + 1 viên  mimosa  + 1/4 viên  zopiclone 7.5mg.
Em muốn hỏi việc mẹ em sử  dụng các thuốc an thần trong 1 thời  gian  dài như  vậy có gây ảnh hưởng  gì về sau không ạ? Và có những cách nào mình có thể hạn chế bớt việc sử  dụng cũng như lệ thuộc thuốc được không bác sĩ?
","Chào bạn.
Câu hỏi của bạn cũng là thắc mắc của nhiều người khi dùng thuốc cho dễ ngủ. Toa trên cũng là thường gặp của 1 BS điều trị giấc ngủ. Thuốc sẽ có tác dụng phụ như khô miệng , táo bón,..  Amitriptilin sau này sớm sẽ được giảm và chuyển thuốc khác vì nó có thể gây loạn nhịp tim ở người trên 60 tuổi.
1 toa thuốc an thần thường dùng trong bao lâu? sẽ tùy người , tùy cơ địa, mà dao động từ 3-6-12 tháng - vài năm. Khi nào ta thấy bác ổn về mặt tinh thần, không còn suy nghĩ tiêu cực, khỏe khoắn cơ thể, đầu óc thư thả thoải mái, thì bác sẽ được giảm liều và cho ngưng. Cũng có rất nhiều trường hợp họ phải dùng thuốc mới ngủ được qua nhiều năm, tuy nhiên họ thấy thoải mái với điều đó , vì sao?
Ta cứ coi như thuốc an thần giống như thuốc điều trị tăng huyết áp, đái tháo đường mà rất phổ biến hiện nay. Uống kéo dài. Như vậy thì ta sẽ thanh thản suy nghĩ hơn. Vả lại, nó cũng không gây ra tác dụng phụ mệt mỏi gì cho bản thân. 
Không phải uống thuốc an thần là giảm trí nhớ, mà ngược lại, không ngủ được mới làm giảm trí nhớ vì chết nhiều neuron trong não. 
Vậy hy vọng bạn cũng đã thấy thoải mái hơn về thuốc nhé. Còn về bác gái, cố găng cho bác tập yoga để tập hít thở, thư giãn, giải phóng cơ thể. Rất tốt ạ.
Thân mến!"
222,Chủ đề nổi bật,https://edoctor.io/hoi-dap/sang-chich-mui-2-nhung-chieu-test-duong-tinh-co-lam-giam-hieu-qua-vaccine,"Xin chào Bác sĩ ạ.
Bác cho em hỏi sáng em đi chích vắc-xin mũi 2 thì chiều em đi test ở khu phố (vì kế bên nhà có người F0) thì kết quả (+). 
Bác tư vấn giùm em liệu mũi chích 2 của em có bị ảnh hưởng gì ko ạ? 
Em cám ơn Bác nhiều lắm ạ.","Chào bạn, bạn chích mũi 2 thì không ảnh hưởng nha. Khi bạn đã chích vacxin mũi 1 thì cơ thể đã có kháng thể và làm nhẹ bệnh khi bạn mắc covid hơn rồi nên bạn có thể yên âm nhé. Bạn chú ý các bài tập thở, sát khuẩn tay và sát khuẩn bề mặt bàn ghế, giường chiếu, nắm cửa, điện thoại hàng ngày, dùng riêng đồ cá nhân nếu ở chung với những người khác, hạn chế tối đa đưa tay lên mũi miệng, xúc họng nước muối nhạt hàng ngày, ăn đầy đủ chất dinh dưỡng và uống đủ nước khoảng 2000ml nước mỗi ngày. Bạn liên hệ ngay với bác sĩ edoctor và y tế phường để được giải đáp nhé. Chúc bạn nhiều sức khỏe và vượt qua đại dịch!"
223,Chủ đề nổi bật,https://edoctor.io/hoi-dap/bi-hut-hoi-kho-tho-co-phai-dau-hieu-cua-soc-phan-ve,"Thưa bác sĩ, cho em hỏi về tiêm vắc-xin astra (Nhật)
Em năm nay 38 tuổi, là nam, em đã được tiêm văcxin mũi 1 loại Astra của Nhật vào ngày 4/8/2021.
Trước ngày tiêm vắc-xin khoảng 1-2 tuần thì em đã làm việc tại nhà, do ở nhà nên em không có đeo khẩu trang thường xuyên và không có đi bên ngoài. Vào ngày tiêm vắc-xin do để bảo vệ mình và người tiếp xúc, em có đeo 2 cái khẩu trang, sau khi thăm khám sàng lọc thì em được cho tiêm vắc-xin bình thường.
Khi được tiêm xong em nhận phiếu đã tiêm và lên lầu 1 của Trung tâm y tế (nơi tiêm) để ngồi nghĩ ngơi, khi em lên tới nơi vừa ngồi ghế thì tự nhiên cảm giác bị hụt hơi, khó thở, xong em có báo nhân viên trung tâm y tế, thì được đưa vào phòng riêng để nghỉ ngơi, lúc này em có tháo khẩu trang ra, có uống một ít nước trà đường, em nằm nghỉ lát thì bình thường trở lại.
Vấn đề bệnh lý về tim mạch, huyết áp từ trước đến ngày tiêm là em không có
Như vậy, trường hợp em có được xem là bị phản ứng phụ cụ thể là sốc phản vệ sau tiêm không? Và lần tiêm mũi 2 tới đây, em có được tiêm không? Em nên chuẩn bị gì cho lần tiêm tiếp theo?
Em xin cảm ơn,","Chào bạn, trường hợp của bạn không được tính là phản vệ sau tiêm vacxin nhé, triệu chứng của bạn có thể bạn lo lắng sợ hãi với mũi tiêm đó. Mũi 2 bạn hoàn toàn có thể tiêm tiếp được. Chúc bạn nhiều sức khỏe và an toàn giữa đại dịch!"
224,Chủ đề nổi bật,https://edoctor.io/hoi-dap/co-bieu-hien-giong-covid-19-nhung-khi-test-lai-am-tinh,"Thưa bác sĩ. Em năm nay 35 tuổi. Em có biểu hiện hoa khan, đau rát họng, hụt hơi, có sốt nhẹ. nhưng khi test nhanh lại ra kết quả âm tính. Và hôm nay em có đi tiêm vaccine. Vậy bác sĩ cho em hỏi. Nếu em khỏi covid-19 thì em tiêm vaccine luôn thì có ảnh hưởng gì không ạ","Chào bạn, triệu chứng của bạn có thể là nhiễm virus thông thường chứ không hẳn nhiễm covid, tuy nhiên cũng chưa thể loại trừ. Nếu bạn nhiễm covid thì việc tiêm vacxin không có ý nghĩa vì trong cơ thể đã có kháng thể rồi, việc tiêm vacxin có thể làm giảm lượng kháng thể đang có. Chúc bạn nhiều sức khỏe!"
225,Chủ đề nổi bật,https://edoctor.io/hoi-dap/ngoai-tai-nhieu-co-the-dan-den-viem-tai,"Giới tính: Nữ, Tuổi: 24
Em bị đau tai như có gì đâm vào sâu trong tai, mấy tuần trước em có bị ù tai và chảy dịch bên phía ngoài tai, ngày 7/9 thì em bị ngứa tai nên em có ngoái tai nhiều lần trong ngày thì hôm sau em bị đau tai nhiều. Em không biết hiện tại khám ở đâu và cũng không biết làm sao để qua được các chốt tới nơi khám ạ?","Chào em! hiện tượng đau tai của em là biểu hiện viêm ống tai ngoài.
Viêm ống tai ngoài: Là tình trạng viêm tai cấp hay mạn tính lớp da bao phủ ống tai ngoài. Bệnh có thể xảy ra ở mọi lứa tuổi, tương đối phổ biến, đặc biệt ở nước ta do khí hậu nóng ẩm, môi trường ô nhiễm cộng với thói quen ngoáy tai bằng dụng cụ không vệ sinh hoặc lau tai quá nhiều lần làm trầy xước lớp da bảo vệ ống tai tạo điều kiện cho vi trùng, nấm xâm nhập và và gây viêm. 
  Phương pháp điều trị khác:
● Sử dụng thuốc kháng sinh nếu bị nhiễm trùng tai giữa hoặc nhiễm trùng lan rộng
● Sử dụng kháng viêm
● Các loại thuốc giảm đau 
● Chườm nước ấm có thể giúp giảm những cơn đau nhẹ.
   Để phòng ngừa viêm tai ngoài, người dân cần tránh để nước vào tai bằng cách đeo nút bịt lỗ tai hoặc mũ bơi khi đi bơi. Không để bệnh viêm tai ngoài trở thành bệnh mạn tính ảnh hưởng đến sức khỏe và thính lực.
Hết dịch nếu các cơn đau kéo dài mặc dù đã điều trị hoặc nếu tai có cảm giác bị tắc. em  cần đi khám bác sĩ Tai Mũi Họng nhé.
Thân chào!"
