,specialty,links,question,answer
441,Chủ đề nổi bật,https://edoctor.io/hoi-dap/bi-viem-lo-tuyen-lam-anh-huong-den-chu-ky-kinh-nguyet,"chào bác sĩ.năm nay em 22 tuổi chưa kết hôn, em đi khám phụ khoa thì chuẩn đoán bị viêm lộ tuyến cấp 3 nhưng do chưa kết hôn sinh em bé nên em chưa dám đốt hay làm thủ thuật gì cả. Chu kì kinh của em thường là 35-37 ngày em thắc mắc không biết phải do bị lộ tuyến mà chu kì kinh dài hơn không ạ? 2 tháng gần đây gần tới ngày hành kinh em có uống cao ích mẫu để điều kinh thì chu kì kinh có ngắn đi chỉ còn 29-32 ngày. Bác sĩ cho em hỏi như vậy có nghiêm trọng hay ảnh hưởng gì không ạ","Chào bạn! Xin trả lời câu hỏi của bạn như sau: Điều đầu tiên là bạn đã quan niệm sai rồi, bạn đã viêm lộ tuyến nặng, bạn cần phải chữa sớm để tránh tạo các bất thường tại tử cung, âm đạo và phần phụ để tránh nguy cơ vô sinh sau này, do vậy bạn cần điều trị tích cực bằng các biện pháp được các bs chỉ định! Khi khám và điều trị bạn nên nói triệu chứng để các bs khám đánh giá chức năng nội tiết của bạn để xem chu kỳ như vậy có do bất thường nội tiết hay không nhé. Trân trọng!"
442,Chủ đề nổi bật,https://edoctor.io/hoi-dap/thuong-dau-nhoi-o-hai-vai-va-lung-da-dung-thuoc-nhung-khong-do-thi-nen-la-sao,Em 18 tuổi mỗi sáng khi ngủ dậy em ngước cổ xuống thì bị đau nhói hai bên lưng dưới bả vai em ngước lên thì bị đau cổ em có chụp x-quang rồi nhưng bác sĩ nói cổ không bị làm sao em có uống thuốc bác sĩ cho nhưng không đỡ vậy có cách nào giảm đau không vậy bác sĩ mong bác sĩ tư vấn giúp em. Em xin cảm ơn.,"chào bạn, thường sau một giấc ngủ mà đau nhói hai bả vai thì vấn đề bạn gặp phải là do bạn ngủ một tư thế quá lâu. Điều đó gây chèn ép các cơ quá lâu sẽ gây thiêu máu cục bộ một số sợi có và nhóm cơ gây đau. Để cải thiện điều này bạn nên tập thể dục thể thao vùng vai cánh tay nhiều hơn đồng thời thay đổi nhiều tư thế trước khi vào giấc ngủ sâu; bên cạnh đó bạn cần đánh giá lại nệm bạn nằm có quá cứng và gối bạn kê có quá cao không; nếu có thì bạn không nên nằm gối nữa và thay đổi nệm.
Sau khi bạn đã cải thiện hết những điều trên mà vẫn không hết sau 01 tháng thì bạn nên đến bệnh viện kiểm tra lại còn các nguyên nhân nào khác không bạn nhé.
Thân mến."
443,Chủ đề nổi bật,https://edoctor.io/hoi-dap/phan-mong-chan-va-da-khong-dinh-vao-nhau-nguyen-nhan-la-vi-sao,"Chào bác sĩ, con em được 22 tháng tuổi. Hiện tại con em đang có ngón cái và ngón trỏ có phần móng và phần da không dính vào nhau, bị tách ra khỏi nhau , và móng 2 ngón đó hơi hơi sần sần. Cho em hỏi là hiện tượng như vậy là bị làm sao ạ ? Và nếu có phải sử dụng thuốc thì nên sử dụng loại nào ạ . Em cảm ơn bác sĩ.","Chào em
Hình ảnh móng tay của bé gọi là liềm móng tay . Móng có chứa một loại protein có tên là keratin. Mỗi móng bắt đầu mọc ra từ phần dưới da được gọi là móng non. Các phần móng non liên tục sinh ra những tế bào mới và đẩy những phần móng già lên trên và phát triển ra ngoài giới hạn của phần thịt được gọi là phần đệm nằm dưới móng. Một khi những tế bào móng già bị đẩy ra khỏi phần đệm này, chúng sẽ chết. do đó liềm móng tay thường là tạm thời, có khả năng biến mất khi móng mọc ra hoàn toàn,
Thân mến chào em"
444,Chủ đề nổi bật,https://edoctor.io/hoi-dap/dai-tien-ra-mau-la-dau-hieu-cua-benh-gi,"Chào bác sĩ ạ, em là nam 23 tuổi.
Sau một thời gian không uống rượu thì vừa rồi có uống lại thì sau đó đi nặng ra máu, máu bám ở phân và tiếp diễn trong 1 ngày, sau đó lại hết và hôm nay lại bị tiếp. Năm ngoái em cũng có uống rượu nặng và sau đó cũng đi ngoài ra máu mấy ngày. Tuy nhiên có một số loại rượu khác em uống lại hoàn toàn bình thường. Em không cảm giác đau khi ngồi cũng như vận động nên không rõ mình bị bệnh gì. Mong bác sĩ tư vấn ạ","Chào em
Sau khi uống rượu sẽ gây kích ứng niêm mạc đường tiêu hóa có thể gây xuát huyết tiêu hóa đi cầu ra máu nhất là sau khi uống rượu mạnh, thường gặp  những người bị trĩ, viêm đai trực tràng... ngoài ra do rượu bia sau khi vào cơ thể sẽ gây kích thích hệ thống tiêu hóa, làm đầy hơi, khó tiêu ,cơ thể mất nước dẫn đến tình trạng táo bón. Việc rặn mạnh khi bị táo bón dẫn đến đi ngoài ra máu khi uống nhiều rượu bia thì cũng có thể gây ra sự kích thích mạnh đến các khối polyp trực tràng gây chảy máu... Do đó nếu sau uống rượu đi đại tiện ra máu em nên đi khám chuyên khoa tiêu hóa để được khám tìm nguyên nhân và có hướng điều trị
Thân mến chào em
"
445,Chủ đề nổi bật,https://edoctor.io/hoi-dap/dang-su-dung-thuoc-huyet-ap-co-nen-bo-sung-them-canxi,"Bác sĩ cho em hỏi mẹ đang uống thuốc huyết áp coveram 5/5, em muốn bổ sung thêm canxi cho mẹ em có được không? Và bổ sung loại nào thì tốt ạ?","Chào bạn
1. Mẹ bạn bổ sung canxi được nha, uống cách ít nhất 2h sau khi dùng thuốc huyết áp và dùng vào buổi sáng. ví dụ như uống thuốc huyết áp lúc 7h thì 9h30 uống canxi.
2. Do có bệnh nền tăng huyết áp nên bạn hạn chế hoặc tốt nhất không sử dụng thuốc dạng sủi vì thuốc sủi có muối kiềm ( natri) không tốt cho người tăng huyết áp.
3. Loại bổ sung canxi tốt cho mẹ bạn theo thứ tự như sau: Cua đồng, tôm, sữa ít đường hay không đường, thuốc dạng viên như Canxi D....
Chúc gia đình sức khỏe!"
446,Chủ đề nổi bật,https://edoctor.io/hoi-dap/phat-hien-cuc-u-ben-nguc-trai-co-phai-dau-hieu-cua-ung-thu-vu,"Em là nam, năm nay 29 tuổi, không bị thừa cân, tập thể thao hàng ngày
2 ngày nay em bị đau vùng đầu ngực bên trái, sờ không rõ u cục, nhưng cảm giác đau như bị sưng, đau khi chạm vào, da vùng xung quanh đỏ nhẹ, chưa xử trí gì, liệu tình trạng của em có phải bị viêm nhiễm hay không, nguyên nhân có thể là gì và có cần lo lắng vấn đề ung thư vú ở nam giới không ạ? em cảm ơn bác sĩ","Chào em!
  Nếu khi gặp tình trạng đau vú ở nam, người bệnh sẽ cảm thấy lo lắng về nguy cơ mắc các bệnh như viêm tuyến vú hay nguy hiểm hơn là ung thư vú. 
Tuy nhiên, đau vú ở nam giới có thể do nhiều nguyên nhân nhưng cũng cần phải cảnh giác để điều trị sớm, hạn chế các nguy cơ biến chứng.
1-Nguyên nhân đau vú ở nam có thể là do:
- Sự thay đổi nội tiết tố.
- Đau vú do dùng nội tiết tố
- Đau vú do quần áo cọ xát vào da: 
- Đau vú do ung thư vú ở nam giới: 
-Đau âm ỉ ngực trái
2- Điều trị.
- Khi nam giới đau vùng vú, dù là nguyên nhân gì thì cũng đều phải cảnh giác. 
Cần đi khám ngay để bác sĩ quyết định xem cần phải làm những xét nghiệm bổ sung nhằm chẩn đoán bệnh:
Thân chào."
447,Chủ đề nổi bật,https://edoctor.io/hoi-dap/f0-da-khoi-benh-thi-con-nguy-co-lay-nhiem-cho-nguoi-than-khong,"Dạ chào bác sĩ. Bác sĩ cho em hỏi là f0 đã khỏi bệnh . Kết quả CT là 35,22 có nguy cơ lây bệnh cho người nhà và khả năng bị nhiễm bệnh lại không ạ. Em cảm ơn","Chào bạn, 
khi xét nghiệm PCR Sar Cov 2 nếu CT trên 24 là virut không phát triển thêm, CT trên 30 thì khả năng lây virut cho người khác rất thấp. Nên hiện tại khả năng lây của bạn đã thấp rồi, nhưng khuyến cáo tốt nhất nên cách ly thêm ở nhà, 5K kỹ lưỡng thêm 10-14 ngày nữa nhé. 
Sau khi khỏi bệnh bạn đã có kháng thể nhưng bảo vệ được tốt hay không tuỳ thuộc cơ địa mỗi người. Kháng thể tồn tại 6 tháng sau nhiễm. khả năng bạn bị nhiễm bệnh lại trong vòng 6 tháng là rất thấp. Nhưng sau 6 tháng thì nguy cơ nhiễm lại tăng lên. 
Chúc bạn khoẻ. Thân. "
448,Chủ đề nổi bật,https://edoctor.io/hoi-dap/lam-the-nao-cai-thien-tinh-trang-chan-an-o-nguoi-lon-tuoi,"Kính chào eDoctor.
Tôi tên Nguyễn thế Toàn, giới tính: Nam.
Độc thân.
Tôi năm nay đã 63 tuổi, khoảng 1 tháng nay tôi thường xuyên chán ăn, mỗi bữa cố gắng chỉ được 1 chén đến 1 chén rưỡi với chút thức ăn, tôi uống nước tốt trên 2 lít/ ngày, ngủ sâu tốt, trong thời gian giãn cách tôi phải bỏ tập thể dục sớm, 1 tiếng/ngày, vì không ra ngoài được, chỉ tập ít ở nhà.
Mong eDoctor tư vấn giúp cho tôi & hướng dẫn cách cải thiện trường hợp này.
Chân thành cảm ơn.
Kính.","Chào anh!
 Bệnh biếng ăn ở người lớn là một vấn đề cần thận trọng và không nên chủ quan, bởi nếu để lâu sẽ gây ra biếng ăn bệnh lý.
1. Nguyên nhân gây ra bệnh biếng ăn ở người lớn
 - Các bệnh về tiêu hóa.
- Ăn kiêng quá mức.
- Rối loạn giấc ngủ.
- Lo lắng, căng thẳng, áp lực.
- Các bệnh mãn tính: 
- Thiếu các vitamin và khoáng chất.
 2 . Cách khắc phục bệnh biếng ăn ở người lớn
  - Nếu nguyên nhân là do stress, áp lực trong công việc thì cần tìm cách giải tỏa căng thẳng để tránh ảnh hưởng đến tinh thần và chất lượng các bữa ăn. 
- Có chế độ ăn lành mạnh, ăn đủ chất và lượng, ăn đúng giờ, không bỏ bữa, đặc biệt là bữa sáng;
- Nên ăn cùng gia đình hoặc bạn bè để tạo không khí thoải mái, vui vẻ, kích thích ăn uống. Khi ăn nên nhai kỹ, không nên làm việc khác khi ăn như xem tivi.
- Nên chia nhỏ các bữa ăn, khoảng 5 - 6 bữa/ngày để tránh cảm giác đầy bụng, khó tiêu.
- Xây dựng thực đơn phong phú với những món ăn yêu thích, các món được trang trí đẹp mắt để kích thích vị giác, giúp ăn ngon miệng hơn; 
- Tăng cường bổ sung các thực phẩm giàu dinh dưỡng.
- Bổ sung các loại thuốc bổ, vitamin để kích thích và cải thiện vị giác như kẽm, sắt, vitamin A, vitamin nhóm B, vitamin E.
- Thường xuyên luyện tập thể dục, thể thao sẽ giúp tiêu hao năng lượng, buộc phải bổ sung năng lượng cho cơ thể, đồng thời cũng giúp ăn ngon miệng hơn.
   Nếu sau khi tự điều trị tại nhà mà triệu chứng biếng ăn bệnh lý vẫn không thuyên giảm, anh nên đến gặp bác sĩ nội khoa để khám và điều trị nhé.
Thân chào!
"
449,Chủ đề nổi bật,https://edoctor.io/hoi-dap/co-nen-ngung-thuoc-nhoi-mau-co-tim-de-tiem-vaccine-covid-19,"Chào bác sĩ 
Ba tôi trước có chích được mũi 1 (astrazeneca), sau bị nhồi máu cơ tim mạch nhánh nhỏ nằm viện hơn một tuần ( không đặt stein ) 
Lúc mới ra viện sức khỏe còn kém , vẫn khó thở và mệt nhức đầu , nhưng giờ đã hồi phục gần như trước đây , ăn ngủ sinh hoạt bình thường 
hiện đang uống thuốc gần 1 tháng rưỡi nay : tim, tăng huyết áp, mỡ máu 
Giờ người ta thông báo tiêm tiếp mũi 2.
nhưng lại bảo phải ngưng thuốc số 1 trong đơn : VIXCAR 75mg (Clopidogrel) một thời gian mới chích được (pfizer)
Xin hỏi bác sĩ : 
- Nếu ba tôi ngưng thuốc như thế có ảnh hưởng gì đến bệnh nền không , và có thể ngưng lâu nhất là bao lâu
- Mũi 2 phải tiêm pfizer hay cả pfizer / astrazeneca đều được
 Mong bác sĩ tư vấn, cám ơn bác sĩ.","Chào em 
 Không khuyến cáo ngưng sử dụng hay trì hoãn sử dụng những loại thuốc đang sử dụng định kỳ để phòng bệnh hoặc điều trị  các tình trạng bệnh khác gần với thời gian tiêm chủng COVID-19. có thể ba em nên tư vấn với bác sỹ khám chọn lọc trước khi chích ngừa vaccine. Mũi hai ba em có thể chích  pfizer / astrazeneca đều được
Thân mến chào em"
450,Chủ đề nổi bật,https://edoctor.io/hoi-dap/cach-ly-tap-trung-co-lam-nguoi-bi-covid-19-nhe-tro-nang,Xác định bị dương tính với Covid19 triệu chứng nhẹ nhưng phải cách ly với những người khác  bị khá là nặng như vậy có làm bản thân nhiễm thêm virus thành bệnh nặng hơn không ạ????,"Chào bạn,
Triệu chứng nhẹ hay nặng phụ thuộc vào tải lượng vi rút và đáp ứng trên cơ địa của bạn, nó còn phụ thuộc vào ngày bệnh của bạn, thường bệnh có thể chuyển nặng từ ngày 5-8 trở đi. 
Việc bạn cách ly với những bệnh nhân Covid 19 bệnh nặng không ảnh hưởng tới 2 điều trên nên bạn đừng lo lắng. Tập trung cho sức khoẻ của mình, uống thuốc, ăn uống đủ , tập thể dục và các bài tập thở, vệ sinh mũi miệng tránh bội nhiễm theo hướng dẫn của BS tại khu cách ly nhé bạn. 
Chúc bạn mau khoẻ. Thân chào. "
451,Chủ đề nổi bật,https://edoctor.io/hoi-dap/co-nen-su-dung-thuoc-huyet-ap-khi-huyet-ap-da-duoc-on-dinh,"Chào Bác sĩ. Tôi là nữ, 55 tuổi. Bình thường huyết áp của tôi từ 11/7 đến 13/8. nhịp tim từ 70 đến 90. Cách đây 1 tuần, huyết áp tôi tăng 14/9, sau đó bị mệt và người cứ bồng bềnh. Tôi đi bênh viện và uống theo toa bác sĩ kê. Sau khi uống thuốc thì huyết áp của tôi chỉ còn từ 9/7, 10/7 đến 11/7 ; 12/8. nhịp tim thì phần lớn từ 65 đến 77. (không chóng mặt)
Vậy tôi có nên tiếp tục uống theo toa thuốc này không, mong bác sĩ tư vấn. cảm ơn bác sĩ.","Chào cô, Các thuốc cô dùng có concor vừa giảm nhịp tim vừa hạ áp. Coversyl plus là thuốc hạ áp nhé. Cô nên uống concor 1 ngày 1 viên và tiếp tục theo dõi huyết áp, nhịp tim cũng như các triệu chứng lâm sàng nhé. Nếu có bất thường cô nên đi khám lại hoặc liên hệ chat trực tiếp bác sĩ edoctor để được hỗ trợ. Chúc cô nhiều sức khỏe!"
452,Chủ đề nổi bật,https://edoctor.io/hoi-dap/tai-sao-khong-nen-dung-thuoc-dieu-tri-xuat-tinh-som-thuong-xuyen,"Bác sĩ ơi cho em hỏi. Em đang dùng thuốc Oyster Man để cải thiện xuất tinh sớm thì em dùng được 3 tháng rồi, nhà thuốc khuyên dùng được 3 tháng xong dừng một tháng, sau đó lại mới dùng tiếp. Uống để duy trì sức khỏe thì ngày uống 1 viên cũng được không cần nghỉ uống. Thì tại sao phải như vậy bác sĩ. Nếu em vẫn muốn dùng như bình thường cho tháng này thì có được không ạ(ngày 2 viên ạ). Và tiện thể bác sĩ cho em hỏi luôn là kẽm có giúp bổ thận và giảm tiểu nhiều lần trong ngày không ạ. Em cảm ơn bác sĩ ạ!!!","Chào em
 Thuốc OYSTER MAN chiết xuất 100% từ Hàu tự nhiên  thành phần   Bột hàu đông khô,   Kẽm oxit ,  Vitamin E. Tác dụng cải thiện sinh lý nam giới cần cải thiện chức năng sinh lý có thể sử dụng 1 viên/ngày; 1 hộp 30 viên sử dụng trong 30 ngày liên tục. Vi chất từ Hàu không chỉ giúp cải thiện chức năng sinh lý, mà còn rất tốt cho cơ, xương, tim và thành mạch máu. Bổ sung khoáng chất cần thiết giúp nâng cao sức khỏe .Thành phần chính trong Hàu Oyster Man là Kẽm, chất xúc tác không thể thiếu trong quá trình sản sinh Testosterone hormone sinh dục quan trọng nhất của nam giới . do đó em xủ dụng theo hướng dẫn của nhà sản xuất  nhé
Thân mến chào em


"
453,Chủ đề nổi bật,https://edoctor.io/hoi-dap/dung-thuoc-gi-de-giam-dau-dau-cang-co-hieu-qua,"Dạ, xin chào bác sĩ! Mẹ em năm nay 55 tuổi có triệu chứng đau đầu căng cơ. xin hỏi bác sĩ có nguy hiểm không và nên dùng thuốc gì để điều trị ạ? Mẹ em dùng Efferalgan Codeine +vitamin 3b 3 hôm rồi mà không thấy giảm đau ạ.
xin cảm ơn và mong bác sĩ tu vấn giúp ạ!","Chào bạn, cảm ơn bạn đã gửi câu hỏi. 
Đau đầu là 1 bệnh thường gặp, khiến bệnh nhân khó chịu, cơn đau có thể ngắn hoặc có thể kéo dài đến vài ngày. 
Tuy nhiên đau đầu có rất nhiều nguyên nhân: ví dụ: bệnh đau đầu migraine, tăng huyết áp, viêm xoang, đau đầu căng cơ,.... trong đó có 1 số bệnh lý nguy hiểm có thể gây ra đau đầu. 
Bạn cần hỏi trực tiếp bác sĩ để có thể biết thêm thông tin và cách điều trị. 
Bạn có thể sử dụng thêm thuốc giãn cơ vân như Eperisone 50mg để giảm tình trạng căng cơ. 
Ngoài ra một số thuốc giúp tăng tuần hoàn não cũng có thể giúp cải thiện triệu chứng. 
Xin thông tin đến bạn. 
Chúc bạn và gia đình sức khoẻ. "
454,Chủ đề nổi bật,https://edoctor.io/hoi-dap/bi-lang-beng-nen-dung-thuoc-gi-de-nhanh-khoi,,
455,Chủ đề nổi bật,https://edoctor.io/hoi-dap/be-7-thang-tuoi-xuat-hien-dom-trang-duoi-luoi-co-nen-dung-thuoc-khong,"Thưa bác sĩ cho em hỏi bé nhà em được 7 tháng tuổi nặng 8kg có bị 1 đốm trắng ngay dưới thắng lưỡi mà em không biết có phải nhiệt miệng hay không. Cho em hỏi có thuốc gì bôi cho trẻ sơ sinh không ạ? Bé vẫn bú mẹ bình thường, không nóng sốt, chơi bình thường chỉ có nhác ăn cháo thôi ạ? ","chào bạn! Nếu chỉ có 1 nốt nhỏ thì chỉ cần vệ sinh bằng cách rơ miệng lưỡi cho bé hằng ngày bằng nước muối sinh lý  là sẽ tự hết bạn nhé. theo dõi nếu sốt, bỏ ăn, xuất hiện nhiều nốt mới thì cho bé đến chuyên khoa khám để chẩn đoán đúng bệnh và có hướng điều trị đúng nhất nhé."
456,Chủ đề nổi bật,https://edoctor.io/hoi-dap/dau-hong-u-tai-hat-hoi-so-mui-sau-khi-tiem-mui-2-vaccine-covid-19-la-nguyen-nhan-gi,"Tôi là nam 27 tuổi…
Tôi mới tiêm vắc-xin Pfizer mũi 2. Qua ngày hôm sau tôi cảm thấy đau ngứa họng, ù tai, sổ mũi và hay hắc xì hơi. Tình trạng như vậy là như thế nào ạ","Chào bạn, bạn có triệu chứng mũi họng được mấy ngày rồi và đã dùng thuốc gì chưa? Trước giờ bạn có triệu chứng gì không? Hiện bạn có ho hay ợ hơi ợ chua gì kèm theo không? Bạn nên đến chuyên khoa Tai mũi họng khám để được tư vấn điều trị sớm nha. Nếu do tình hình dịch khiến bạn không đi khám được thì bạn liên hệ chat trực tiếp bác sĩ edoctor để được hỗ trợ nha. Chúc bạn nhiều sức khỏe!"
457,Chủ đề nổi bật,https://edoctor.io/hoi-dap/hay-cuoi-co-phai-trang-thai-tam-ly-bat-on,"Em 27 tuổi. Giới tính nữ. 
Bác sĩ cho em hỏi em hay cười một mình, cười vô lý, cười chuyện riêng bất kể có người hay không có người, cười bất giác không kiểm soát được dù hoàn cảnh bên ngoài không phù hợp có sao không? có phải bệnh không? có cần chữa trị và uống  thuốc không? vì em sợ lỡ có ai thấy em sẽ bị hiểu lầm. cám ơn bác sĩ 😔","Chào em.
Không biết tình trạng của em đã xảy ra bao lâu, có bắt nguồn từ 1 vấn đề/ biến cố gì hay ko. Ngoài triệu chứng cười vô cớ nhu vậy, còn vấn đề gì khác? (nghe tiếng ai nói dù ko có ai kế bên? thấy những hình dạng bất thường, thấy cả người đã mất? hoang tưởng mình đang bị hại? đang có 1 kế hoạch lớn lao? )
Nếu có các vấn đề trên, BS khuyên em nên tới khám tại các khoa Tâm Thần ở BV Đại học Y dược tpHCM, bệnh viện Tâm Thần ở Hàm Tử, .. nhé
Thân chào"
458,Chủ đề nổi bật,https://edoctor.io/hoi-dap/thuong-xuyen-hoa-mat-chong-mat-co-the-la-dau-hieu-cua-tien-dinh,"Em bị hoa mắt, chóng mặt, buồn nôn. Mỗi khi bị vậy xong người thường đổ mồ hôi. Hiện em bị 5 ngày rồi. Đã uống thuốc Betaserc 16 đc 3 ngày. Sáng 2 viên tối 2 viên mà không thấy đỡ. Em muốn hỏi có phải em bị rối loạn tiền đình không. và cần uống thuốc và điều trị như thế nào. Mong bác sĩ tư vấn và khám giúp ạ!","Chào em
 Những biểu hiện của em nhiều khả năng em bị hội chứng rối loạn tiền đình
Rối loạn tiền đình là hội chứng của rất nhiều nguyên nhân và bản chất của nó là hậu quả của sự rối loạn tích hợp thăng bằng tại bộ máy tiền đình và tại thần kinh trung ương. Điều này khiến cho tiền đình mất khả năng giữ thăng bằng, cơ thể loạng choạng, hoa mắt, chóng mặt, quay cuồng,  buồn nôn... Em có thể dùng thêm thuốc giảm triệu chứng chóng mặt Tanganil 500mg uống 1viên  x 3 lần /ngày, hoạt huyết dường nào 2 viên x 2 lần ngày
Thân mến chào em"
459,Chủ đề nổi bật,https://edoctor.io/hoi-dap/da-khoi-nhung-van-xuat-hien-cac-trieu-chung-nhu-nhiem-covid-19,"Dạ em xin chào các Bác Sĩ,
- Bạn gái em là nữ, 21 tuổi, mới vừa khỏi covid cách nay 1.5 tháng
- Từ 04 hôm nay (26-29.09.2021) các gái em gặp các triệu chứng sau:
+ Nóng người trong khoảng 21h00 pm đến 05h00 am hôm sau ( Khi thức dậy cơ thể không đau nhức).
+ Có ho ( ít, ho khang không có đàm)
+ 2 ngày đầu ( 26-27.09.2021) có dùng para sủi để uống chỉ bớt tại thời điểm đó nhưng không hết hoàn toàn.
Dạ nhờ Bác Sĩ tư vấn giúp em nguyên nhân bệnh và cách chửa trị.
Em trân trọng cảm ơn!","Một số người bệnh sau khi đã hết thời gian bệnh Covid 19 vẫn còn triệu chứng như ho, đau ngực, mệt mỏi, triệu chứng dạ dày- ruột như tiêu chảy, đau bụng, trào ngược… sau nhiễm đến 3-6 tháng hoặc thậm chí lâu hơn. Nếu các triệu chứng mới xuất hiện gần đây thì có thể không liên quan đợt bệnh Covid 19 vừa rồi. Em cho súc miệng nước muối để xem ho có đỡ không (vì chỉ ho khan ít chưa cần uống thuốc), ăn nhiều hoa quả và bổ sung Vitamin. Nếu tình trạng còn kéo dài nên đi khám tại cơ sở y tế để làm thêm xét nghiệm về tuyến giáp, tiêu hoá, hô hấp. "
460,Chủ đề nổi bật,https://edoctor.io/hoi-dap/bi-di-ung-khang-sinh-khong-the-tiem-vaccine-covid-19-phai-lam-sao,"Dạ chào bác sĩ, em năm nay 28 tuổi, hôm nay em có đi khám sàng lọc trước khi tiêm vacxin ngừa Covid-19, kết quả em bị dị ứng với kháng sinh nên không thể tiêm được, bác sĩ cho em hỏi vậy em có thể tiêm loại vacxin ngừa Covid loại  nào được ạ? ","Chào em. Theo em mô tả vậy có thể đây là mũi đầu tiên. BS không rõ em ở tỉnh nào.
Tiêm vaccine, bất kì loại nào cũng đều có tỉ lệ 1/1000000 gây dị ứng. Tuy nhiên, nó không liên quan gì đến dị ứng kháng sinh ngày trước. Bằng chứng là rất rất nhiều người có dị ứng kháng sinh, vẫn tiêm vaccine bình thường và khỏe mạnh, ko bị chút dị ứng nào.
Thông thường ở chỗ tiêm cộng đồng, do e ngại ko đủ phương tiện xử trí dị ứng (dù thật ra chỉ là 1 ống bơm Adrenalin, lập đường truyền) nên họ từ chối tiêm và sắp xếp em vào BV để tiêm.
Về câu hỏi của em, thì ở BV sẽ sắp xếp cho em tiêm vaccine có thể là Astra, Pfizer... kể cả VeroCell cũng hiếm có dị ứng, nên tiêm loại nào cũng được, việc theo dõi sau tiêm trong 30 phút tại chỗ tiêm và 24h sau khi về nhà, mới là quan trọng.
Em đã rõ rồi nhé. Thân chào em"
