,specialty,links,question,answer
0,Chủ đề nổi bật,https://edoctor.io/hoi-dap/huyet-ap-cao-145-mmhg-co-can-uong-thuoc,"Bác Sĩ ơi
Vui lòng cho em hỏi
Người già 78t có huyết áp là 145 thì có cần uống thuốc hạ huyết áp không ạ ?
Người này có tiền sử là cao huyết áp ạ..
E cảm ơn BS đã tư vấn..
",Chào bạn! Cảm ơn bạn đã gửi câu hỏi đến eDoctor! Với huyết áp tối đa là 145 mmHg khi đo ở điều kiện bình thường thì cần kiểm soát huyết áp bằng thuốc huyết áp bạn nhé và duy trì liên tục để hạn chế các biến chứng do tăng huyết áp gây nên. Trân trọng
1,Chủ đề nổi bật,https://edoctor.io/hoi-dap/bi-viem-gan-b-co-gay-ngua-hay-khong,"Nam 30 tuổi
Bác sĩ cho em hỏi là mắc viêm gan B có gây ngứa không ạ
Em đã đi xét nghiệm giun sán nhưng không có,họ bảo men gan tăng cao cũng gây ngứa,em hoang mang quá không biết nên đi khám gì,mong bác sĩ giải đáp hộ ạ…Em xin cảm ơn","Chào bạn, gan làm nhiệm vụ chuyển hóa các chất trong cơ thể, từ đó dễ đào thải ra ngoài. Khi chức năng gan bị suy giảm có thể gây tích tụ một số chất gây ngứa da. Tuy nhiên nguyên nhân gây hay gặp hơn là bệnh lý da.  Bạn nên đi khám chuyên khoa da liễu để bác sĩ thăm khám, xác chính xác nguyên nhân gây ngứa. Thân mến. "
2,Chủ đề nổi bật,https://edoctor.io/hoi-dap/benh-gian-tinh-mach-viem-gan-b-the-ngu-mau-nhiem-mau-co-phai-la-benh-nen,"tôi bị giãn tĩnh mạch chân,viêm gan B thể ngủ,máu nhiễm mỡ có gọi là bệnh nền không ạ","Chào cô, năm nay cô bao nhiêu tuổi và có bệnh lý gì khác không? Các bệnh trên có thể coi là bệnh nền, mạn tính. Chúc cô nhiều sức khỏe!"
3,Chủ đề nổi bật,https://edoctor.io/hoi-dap/hoi-di-tieu-nhieu-lan-khi-ngu-la-benh-gi,"Xin chào bác sĩ, gần đây cứ mỗi lần nằm nghỉ trưa hay tối, tôi hay đi tiểu rất nhiều lần. Đó là triệu chứng gì và cách khắc phục. Cám ơn BS nhiều","Chào bác,

Đi tiểu thường xuyên là triệu chứng của nhiều nguyên nhân. 
Cần ghi nhận thêm: Lượng nước tiểu của mỗi lần đi tiểu? Tổng lượng nước tiểu trong ngày? Tính chất nước tiểu? Các triệu chứng khác đi kèm? Có đang dùng thuốc gì không?

Nếu tiểu nhiều lần, mỗi lần một ít gọi là tiểu lắt nhắt. Nếu tiểu lắt nhắt đi kèm với sốt, đau khó chịu vùng hố chậu gợi ý bệnh cảnh nhiễm trùng đường tiểu. Ngoài ra, một số nguyên nhân có thể gặp là:
- Đái tháo đường
- Bệnh lý tuyến tiền liệt
- Viêm bàng quang kẽ
- Tổn thương thần kinh
- Hay đang dùng thuốc lợi tiểu
Ngoài ra còn có một số nguyên nhân hiếm gặp.

Việc chẩn đoán nguyên nhân cần sự hỗ trợ của các xét nghiệm nước tiểu, xét nghiệm máu, siêu âm...

Bên cạnh việc điều trị bệnh nền, bệnh nhân có thể thực tập một số thay đổi nhỏ trong lối sống:
- Tập nhịn tiểu theo lộ trình của bác sĩ hướng dẫn nhằm kéo dài 
- Theo dõi chế độ ăn và dùng thuốc
- Theo dõi lượng nước uống vào
- Bài tập Kegel: bài tập này nam hay nữ đều có thể thực tập.

Hy vọng những thông tin này có ích cho bác. 
Trân trọng."
4,Chủ đề nổi bật,https://edoctor.io/hoi-dap/benh-vien-nao-chuyen-dieu-tri-gout,"bác sĩ cho e hỏi: e bị bệnh gút khoảng 8 năm, do cviec nên có uống rượu bia và thỉnh thoảng bị đau nhức ở ngona chân cái và đã hình thành các hạt tophi nen e muốn đi khám ở bệnh viện nào chuyên điều trị ạ","Chào bạn, cám ơn bạn đã gửi câu hỏi
   Gút là bệnh lý cơ xương khớp khá phổ biến, diễn tiến mạn tính, điều trị chủ yếu là hạn chế triệu chứng, biến chứng. Bạn có thể đến khám và điều trị ở các bệnh viện có chuyên khoa cơ xương khớp đều được. Bên cạnh đó cần hạn chế bia rượu, các loại thịt đỏ, ăn thêm rau xanh trái cây, uống đủ nước...
Chúc bạn nhiều sức khoẻ - Thân chào bạn"
5,Chủ đề nổi bật,https://edoctor.io/hoi-dap/hoi-muon-chuyen-qua-thuoc-dieu-tri-tieu-duong-khac-co-nen-khong,"Tôi là nữ, 67 tuổi. Tôi đang điều trị tiểu đường dùng Glucophage 850mg, ngày uống 2 viên sáng và tối. Hiện tại buổi sáng đo đường huyết lúc chưa ăn dao động ở 5.0 đến 6.8 . 
Tôi có anh bạn cùng tuổi cũng đang điều trị tiểu đường nhưng anh ấy dùng Diamicron MR 60mg, mỗi ngày anh ấy chỉ uống 1 viên vào buổi sáng, tôi thấy như vậy đơn giản hơn, đỡ bị quên. 
Câu hỏi của tôi: Tôi muốn chuyển sang dùng thuốc Diamicron giống anh bạn tôi có được không?
Cám ơn Bác sĩ.","Chào bác, cảm ơn bác đã gửi câu hỏi về eDoctor! Xin trả lời câu hỏi của bác, bác dùng Glucophage (Metformin) và đáp ứng tốt đó là điều may mắn, vì metformin đã chứng minh được sự ưu việt khi dùng để kiểm soát đường máu và cũng được ưu tiên sử dụng. Do vậy, bác không cần đổi sang Diamicron chỉ vì để tiện uống hơn. Trân trọng!"
6,Chủ đề nổi bật,https://edoctor.io/hoi-dap/benh-ly-tim-mach-co-phai-dung-thuoc-ca-doi,"Chào Bác sĩ, tôi năm nay 50 tuổi cách đây 3 năm tôi tình cờ khám và biết mình bị hội chứng W.P.W chỉ thỉnh thoảng bị tim đập rất mạnh và nhanh rồi hết. Tôi khám ở bệnh viện 115, bác sĩ đề nghị chuyển qua bệnh viện Thống Nhất để đốt. Do chưa đủ điều kiện và hoàn cảnh gia đình khó khăn tôi xin về và đi bác sĩ chuyên khoa tim mạch ngoài giờ cho uống thuốc đã hơn 2 năm. Xin Bác sĩ tư vấn giúp có nên đi đốt gì gì đó hay nên uống suốt đời ạ. Cám ơn Bác Sĩ . 


","Chào cô ạ, Nếu hiện tại cô uống thuốc duy trì ổn định thì cô có thể tiếp tục duy trì thuốc để kiểm soát nhịp tim cô nhé. Nếu thuốc không đáp ứng hoặc đáp ứng kém mới xét đến vấn đề can thiệp ạ. Cô nên đi khám định kì tại chuyên khoa tim mạch để được kiểm soát nhịp tim và điều chỉnh thuốc nếu cần thiết nha. Chúc cô nhiều sức khỏe!"
7,Chủ đề nổi bật,https://edoctor.io/hoi-dap/hoi-khi-cac-chi-so-da-binh-thuong-thi-co-can-phai-uong-duy-tri-thuoc-mo-mau-va-huyet-ap-hay-khong,,
8,Chủ đề nổi bật,https://edoctor.io/hoi-dap/hoi-lam-sao-de-giam-can-hieu-qua,"Chào bác sĩ, em năm nay 17 tuổi bị béo phì. Em cao 1m63 nặng 87kg, em đã thử nhiều phương pháp ăn kiêng giảm cân khác nhau như keto, low carb nhưng đều không hiệu quả. Mong bác sĩ tư vấn cho em cách giảm cân hiệu quả.","Chào em,
Hiện tại với cân nặng và chiều cao của em thì tính được chỉ số BMI =32.7kg/m2 thì bạn được chẩn đoán béo phì độ 2 (theo IDI&WPRO).
Bạn đang muốn giảm cân và đang bối rối không biết ăn thế nào để giảm cân thành công mà đơn giản, dễ làm. Sau đây là những gợi ý bạn có thể tham khảo chế độ giảm cân lành mạnh.
1/ Nguyên tắc khi giảm cân
- Nguyên tắc khi thực hiện giảm cân là giảm 5-10% cân nặng trong 3-6 tháng, trung bình là 2kg/tháng (khoảng 0,5kg/tuần), không quá 4kg/tháng. Bạn cần chia nhỏ bữa ăn thành 5 bữa/ngày. Trong đó, bữa ăn tối cách giờ đi ngủ trên 2 tiếng. Tổng năng lượng bữa tối phải < 20% năng lượng khẩu phần.
- Ngoài ra, người thừa cân béo phì cần tuân thủ các nguyên tắc sau để giảm cân hiệu quả:
- Giảm lượng calo trong chế độ ăn uống hàng ngày. Muốn vậy, cần kiểm soát thành phần bữa ăn và hàm lượng dinh dưỡng trong mỗi thực đơn.
-Tránh tất cả các thực phẩm nhiều chất béo (thịt mỡ, thịt chân giò, nước hầm xương, các món chiên xào, fastfood, món ăn ngọt…).
-Chia khẩu phần ăn thành nhiều bữa nhỏ hơn (thay vì một khẩu phần lớn). 
-Học cách chế biến thực phẩm an toàn, lành mạnh (ví dụ không dùng mỡ động vật khi chế biến thức ăn; hạn chế chiên, xào, nướng và thay bằng hấp, luộc…).
-Chọn các món ăn bổ dưỡng ít chất béo (như salad không sốt, nước ép rau củ quả nguyên chất…).
-Tăng cường tập luyện (ít nhất 60 phút/ngày, 5 ngày/tuần).
-Bên cạnh đó, người thừa cân nên uống ít nhất 8 cốc nước lớn mỗi ngày. Uống đủ lượng nước giúp đẩy nhanh quá trình chuyển hóa chất béo và tránh giữ nước.
2/ Một số lời khuyên cho chế độ giảm cân
- Cắt giảm lượng tinh bột (cơm, bún, phở, bánh mì…), đường (nước ngọt có ga, sữa có đường,…) nên dùng đường ăn kiêng.
- Ăn tăng cường đạm, chất béo lành mạnh và rau ít carb.
Nguồn protein lành mạnh bao gồm: Thịt: thịt bò, thịt gà, thịt lợn nạc, cá…. Cá và hải sản: cá hồi, cá hồi và tôm. Trứng: toàn bộ trứng với lòng đỏ. Protein từ thực vật: đậu, đậu và đậu nành
Nhiều loại rau chứa ít carbs, bao gồm: Bông cải xanh, súp lơ, rau bina, cà chua, cải xoăn, bắp cải Brucxen, cải bắp. Bổ sung nhiều vitamin và chất xơ từ các rau, củ, quả.
Nguồn chất béo lành mạnh bao gồm: Dầu ô liu, dầu dừa, dầu bơ, bơ.
- Phối hợp các động tác vận động tập luyện nhẹ nhàng tại nhà ít nhất mỗi ngày 30-60phút
Nếu nâng tạ không phải là một lựa chọn cho bạn, thì thực hiện một số bài tập tim mạch như đi bộ, chạy bộ, chạy bộ, đạp xe hoặc bơi lội.
- Uống nhiều nước mỗi ngày 2-2,5 lít, uống nước trước các bữa ăn chính (khoảng 300-500ml trước ăn 30 phút).
- Đừng bỏ bữa sáng: Bỏ bữa sáng sẽ không giúp bạn giảm cân. Bạn có thể bỏ lỡ các chất dinh dưỡng thiết yếu và cuối cùng bạn có thể ăn vặt nhiều hơn vì cảm thấy đói.
- Ăn trứng cho bữa sáng: Các nghiên cứu cho thấy việc thay thế bữa sáng bằng ngũ cốc, bằng trứng có thể giúp bạn ăn ít calo hơn trong 36 giờ tới cũng như giảm cân và mỡ trong cơ thể.
Bạn nên kiên nhẫn để có chế độ ăn phù hợp và tập luyện để có được liệu trình giảm cân lành mạnh, hạn chế sử dụng các thực phẩm chức năng và các loại thuốc giảm cân, tránh gây ảnh hưởng và tác dụng phụ ngược lại với sức khoẻ.
Chúc bạn có chế độ giảm cân lành mạnh và thành công!
"
9,Chủ đề nổi bật,https://edoctor.io/hoi-dap/can-nang-dinh-duong-cua-tre-2-tuoi-la-bao-nhieu,Bác sĩ ơi bé gái nhà em 2tuổi cao 86 nặng 12kg cách đây 2 tháng bé 14kg sao khi bé bị f0 rồi bệnh đến hôm nay bị sụt còn 12kg vậy bác sĩ cho em hỏi bé có bị thiếu kí không ạ em cảm ơn ,"Chào bạn, với lứa tuổi của bé 12 kg không phải là quá nhẹ cân. Cân nặng bình thường của bé gái 2 tuổi là 11.5kg. Bé có nguy cơ suy dinh dưỡng nếu có cân nặng 10.1kg hoặc bị suy dinh dưỡng nếu cân nặng chỉ 9.2kg. Ngược lại, bé có nguy cơ béo phì nếu cân nặng đạt 13.1kg và bị béo phì nếu cân nặng đạt 14.6kg. Thân mến. "
10,Chủ đề nổi bật,https://edoctor.io/hoi-dap/duong-gan-mau-tim-dam-to-o-duoi-luoi-co-nguy-hiem,"bác sĩ cho cháu hỏi nay cháu soi giơng thấy dưới lưỡi có 2 đường gân màu tím đậm rất to và đậm, không biết vậy có ảnh hưởng gì không ạ","Chào bạn!
Đó là hình ảnh tĩnh mạch lưới thôi, bình thường bạn nhé
Thân mến"
11,Chủ đề nổi bật,https://edoctor.io/hoi-dap/nuoc-mui-co-mau-la-dau-hieu-cua-benh-gi,"Em chào Bác Sĩ
Em tên Nguyễn Văn Khắc Điệp, SN 1995, Giới tính Nam
Hiện tại em bị đau họng biểu hiện là: dịch mũi có máu bên mũi phải và đờm có máu.
Như vậy là bị gì bác sĩ ơi???
Em cảm ơn Bác Sĩ ạ","Chào bạn!
Như bạn mô tả có thể bạn đang viêm mũi họng cấp, tuy nhiên bạn có hỉ mũi ra máu thì bạn nên đi khám bs tai mũi họng để bs tìm hiểu nguyên nhân từ đâu, khi đó mới điều trị đặc hiệu cho bạn được
Thân mến"
12,Chủ đề nổi bật,https://edoctor.io/hoi-dap/dau-hieu-cua-viem-nhiem-tiet-nieu,"tôi là nam.năm nay 37t.
mấy hôm nay.Khi tiểu gặp tình trạng tiểu són, hơi buốt trong người, đau tức phần bụng dưới.
như vậy là bị sao ạ.xin cám ơn bác sĩ
","Chào anh, triệu chứng của anh có thể là nhiễm khuẩn tiết niệu. Anh nên đến khám tại chuyên khoa thận tiết niệu để khám và điều trị nhé. Ngoài ra anh nên uống mỗi ngày khoảng 2000-2500ml để hạn chế nguy cơ nhiễm khuẩn ngược dòng nha. Chúc anh nhiều sức khoẻ!"
13,Chủ đề nổi bật,https://edoctor.io/hoi-dap/bi-gan-nhiem-mo-co-can-uong-thuoc,bác sĩ ơi e đi siêu âm thì ng ta bảo e bị gan nhiễm mỡ nhưng lúc đó bác sĩ lại không kê toa cho e vậy e có cần phải uống thuốc gì không và có cần kiêng ăn gì không ạ?,"Chào bạn, hiện gan nhiễm mỡ chưa có thuốc điều trị đặc hiệu, bạn nên điều chỉnh chế độ ăn để giảm mỡ động vật nội tạng và uống nhiều nước hàng ngày, giảm cân nếu thừa cân nhé! Ngoài ra bạn có thể uống vitamin E để hạn chế oxy hoá tế bào gan và duntf trong thời gian ngắn khoảng 15-30 ngày nhé. Chúc bạn nhiều sức khoẻ!"
14,Chủ đề nổi bật,https://edoctor.io/hoi-dap/cac-dau-ngon-tay-bi-den-o-nguoi-lon-tuoi-do-dau,"Cho em hỏi, người nhà em ( cụ thể là ông em - 74  tuổi ) trong 3 ngày gần đây có hiện tượng phần da các đầu ngón tay, ngón chân bị thâm đen, bị vậy có làm sao không ạ?","Chào bạn, bạn nên đưa ông đến ngay chuyên khoa tim mạch để khám vì tổn thương như bạn mô tả có nguy cơ tắc mạch và hoại tử đầu chi nhé. Chúc ông và gia đình nhiều sức khoẻ!"
15,Chủ đề nổi bật,https://edoctor.io/hoi-dap/dau-khop-ngon-tay-ut-ben-phai-nen-dieu-tri-uong-thuoc-gi,"xin hỏi Bác Sỹ tự nhiên ngón tay út(bên phải) bị đau như đau khớp,như vậy là triệu chứng gì,và phải điều trị thuốc gì.xin cám ơn Bác Sỹ","Chào bạn, ngoài triệu chứng đau bạn có sưng nóng đỏ vùng khớp đó không và có đau ở vị trí nào khác không? Bạn nên đến chuyên khoa cơ xương khớp để khám và tìm nguyên nhân điều trị nhé. Trường hợp của bạn cần siêu âm và chụp xquang để đánh giá tổn thương xương hoặc gân cơ vùng ngón tay nha. Chúc bạn nhiều sức khoẻ!"
16,Chủ đề nổi bật,https://edoctor.io/hoi-dap/chu-ky-kinh-nguyet-it-do-niem-mac-tu-cung-mong-phai-lam-sao,"dạ em chào các bs em năm nay 26 tuổi chu kỳ kinh nguyệt của e 1 năm chỉ có 1-2 lần e đi khám bs bảo niêm mạc tử cung của em là 0,25cm em muốn hỏi giờ ăn gì hay có phương pháp nào để tăng niêm mạc lên không ạ e cảm ơn ạ","Chào bạn. Niêm mạc tử cung mỏng có thể xuất phát từ các nguyên nhân: Thiếu hụt estrogen, lớp nội mạc tử cung bị tổn thương do từng nạo phá thai trước đó, do cơ thể thiếu máu hoặc tình trạng mô tuyến của lớp niêm mạc tử cung phát triển bên trong cơ của thành tử cung...Bạn nên đi khám chuyên khoa sâu sản phụ khoa để xác định nguyên nhân, tùy từng nguyên nhân khác nhau bác sĩ sẽ có phác đồ điều trị khác nhau ạ. Thân mến. "
17,Chủ đề nổi bật,https://edoctor.io/hoi-dap/tap-the-duc-tai-nha-co-hieu-qua,"Bác sĩ cho em hỏi là tự tập thể dục ở nhà có tốt hơn là đến các phòng tập thể dục có huấn luyện viên hướng dẫn không, tự tập thể dục ở nhà hiệu quả có cao không","Chào bạn! Cảm ơn bạn đã gửi câu hỏi đến eDoctor! Vấn đề bạn hỏi phụ thuộc vào sự quyết tâm, ý chí, cách thức và điều kiện hoàn cảnh của bạn. Nếu bạn quyết tâm và có nền tảng về tập luyện thì bạn tập ở đâu cũng có hiệu quả mong muốn, tất nhiên ở những nơi chuyên nghiệp thì sẽ tốt hơn! Trân trọng"
18,Chủ đề nổi bật,https://edoctor.io/hoi-dap/cach-tranh-thai-hieu-qua-va-an-toan-100-lieu-co-khong,,
19,Chủ đề nổi bật,https://edoctor.io/hoi-dap/keo-dai-thoi-gian-quan-he-bang-thuoc-nao,bác sĩ ơi cho em hỏi có thuốc nào kéo dài thời gian quan hệ cho nam không ạ và biện pháp tránh thai an toàn và hiệu quả nhất là biện pháp nào vậy bác sĩ .    Mong bác sĩ trả lời giúp em,"Chào bạn, không có thuốc nào kéo dài thời gian quan hệ đâu ạ, mà bạn nên luyện tập dần. Không có biện pháp tránh thai nào là hiệu quả và an toàn 100% , đa số đều trên 95% . Các biện pháp tránh thai an toàn và phổ biến là bao cao su, thuốc tránh thai, vòng tránh thai...Thân mến. "
20,Chủ đề nổi bật,https://edoctor.io/hoi-dap/ho-lau-ngay-trong-vong-1-thang-la-dau-hieu-benh-gi,"ho lâu ngày ( 1 tháng) ngứa họng là ho, ợ nước lên họng, cảm giác nóng họng và chua.","Chào anh, triệu chứng của anh có thể là viêm trào ngược dạ dày thực quản dẫn tới viêm họng. Anh nên đến chuyên khoa tiêu hoá và tai mũi họng để khám và điều trị sớm nhé. Ngoài ra anh nên hạn chế thức ăn chua cay, rượu bia cafe, ngủ sớm để giảm các triệu chứng nhé. Chúc anh nhiều sức khoẻ!"
21,Chủ đề nổi bật,https://edoctor.io/hoi-dap/lam-sao-de-biet-minh-co-bi-nhiem-virus-hpv-hay-khong,BSi cho tôi hỏi đối với nam giới làm sao để biết mình có bị nhiễm virus HPV hay không? và đối với người mắc virus HPV có chữa khỏi hoàn toàn được không? Xin cảm ơn bs,"Chào anh, để biết nhiễm HPV anh nên đến chuyên khoa da liễu khám và làm xét nghiệm nhé. HPV có thể chữa khỏi nhưng tuỳ thể bệnh và yếu tố nguy cơ đi kèm. Chúc anh nhiều sức khoẻ!"
22,Chủ đề nổi bật,https://edoctor.io/hoi-dap/be-thuong-xuyen-quay-khoc-luc-ngu-phai-lam-sao,"bé nhà em được 7,5 tháng tuổi. Khoảng 2 tuần gần đây bé bị trằn trọc khi ngủ đêm, đêm thức dậy khoảng 5 lần, khóc to và ko tự ngủ lại được. Dù trước đó bé ngủ đêm tốt. Bé cân nặng 9kg, được bổ sung vitamin D3 từ lúc sơ sinh. Em muốn hỏi tình trạng này có bất thường không và em cần làm gì để giúp con tìm lại được giấc ngủ ngon. Cảm ơn bác sĩ. ","Chào bạn, nguyên nhân gây khó ngủ cho bé có rất nhiều như nóng ( bạn cần kiểm tra cổ gáy, tóc, lưng bé có mồ hôi không), buồn tiểu, đói, giật mình... Bạn cần kiểm soát các yếu tố trên. Ngoài ra bạn nên xem lại giấc ngủ ngày của bé có nhiều không, giấc ngủ buổi chiều có cách buổi tối đủ xa không... Thân mến. "
23,Chủ đề nổi bật,https://edoctor.io/hoi-dap/hoi-phuc-gay-xuong-dot-2-ngon-tro-bang-cach-nao,"xin chào bs .tôi bị gãy xương đốt 2 ngón trỏ nay được 4 tuần rồi ,hiện tại những vết thương hở đã kéo da nhưng khi cặp nẹp thì ngón tay vẩn bị sưng phù và ngón tay hơi bị cong, đi khám và chụp phim bv chỉ cho thuốc giảm đau .xin được tư vấn ạ .","Chào bạn, có thể tổn thương của bạn đang trong quá trình hồi phục. Do ảnh hưởng của chấn thương , của sẹo co kéo ngón tay biến dạng. Hiện tại không nhiễm trùng nên bác sĩ chỉ cho thuốc giảm đau. Bạn nên theo dõi thêm, có thể đi khám thêm chuyên khoa Phục Hồi Chức Năng để bác sĩ tư vấn biện pháp giảm nhẹ. Thân mến. "
24,Chủ đề nổi bật,https://edoctor.io/hoi-dap/mat-ngu-tim-dap-nhanh-co-the-la-van-de-cua-stress,"dạ em chào bác sĩ em là nam năm nay em 33 tuổi em bị mất ngủ và ngủ hay bị giật mình và hồi hộp mỗi lần như vậy tim em đập rất nhanh. Em chưa điều trị lần nào hết, bác sĩ cho em hỏi em phải điều trị như thế nào và phải đi khám làm sao ạ em cảm ơn bác sĩ ?","Chào bạn! Cảm ơn bạn đã gửi câu hỏi đến eDoctor, vấn đề của bạn có thể liên quan đến stress họăc những suy nghĩ quá mức, tuy nhiên, do không đựơc đánh giá nên bs chưa định huớng rõ ràng tình trạng của bạn là gì cả, bạn nên đi khám để đánh giá cũng như căn cứ vào đó bs sẽ kê đơn hỗ trợ cho bạn. Trân trọng"
25,Chủ đề nổi bật,https://edoctor.io/hoi-dap/thuoc-nho-mat-giup-han-chet-moi-mat-cay-mat,"Em 24 tuổi, bầu 28 tuần, thường xuyên làm việc máy tính nên rất hay mỏi mắt, cay mắt. BS cho em hỏi nên dùng loại thuốc nhỏ mắt nào được ạ? Em cảm ơn ạ",Chào bạn. Để giảm mỏi nhức mắt bạn có thể nghỉ ngơi mắt nhiều hơn theo nguyên tắc 20:20:20 tức là làm việc 20 phút nghỉ ngơi mắt 20 giây bằng cách nhìn xa 20 feet  (tức là 6 mét). Bạn có thể dùng thêm nước muối sinh lý nhỏ mắt cho bớt khó chịu. Thân mến. 
26,Chủ đề nổi bật,https://edoctor.io/hoi-dap/so-gan-va-gan-nhiem-mo-khac-nhau-ra-sao,Bs siêu âm em bi sơ gan về uống thuốc được nữa tháng e đi tái khám lại bs bảo em bị gan nhiễm mỡ vậy tóm lại em bi ji vậy bs,"Chào bạn! 
chỉ có kết quả siêu âm thì chưa đánh giá được xơ gan hay không, mình có thể làm thêm xét nghiệm men gan nữa nhé. Ở độ tuổi của bạn nghĩ đến gan nhiễm mỡ nhiều hơn xơ gan."
27,Chủ đề nổi bật,https://edoctor.io/hoi-dap/noi-man-khong-ngua-khong-rat-phai-lam-sao,"Em là Tấn Anh, Nam, 29 tuổi. Em bị nổi mẫn 2 ngày nay, không rát, không ngứa. Cho em hỏi bác sĩ tình trạng này có nguy hiểm không ạ. Em đính kèm hình ảnh ạ.","Chào bạn! 
hình ảnh trên nghĩ đến có thể do xuất huyết dưới da, hoặc viêm mao mạch gây nên. 
bạn nên đi khám và xét nghiệm kiểm tra để tìm nguyên nhân và điều trị nhé. "
28,Chủ đề nổi bật,https://edoctor.io/hoi-dap/cach-khac-phuc-xuat-tinh-som,"cháu chào bác sĩ
hiện cháu đang bị xuất tinh sớm 
bây giờ cháu cần làm gì và uống thuốc gì để cải thiện ạ
hiện cháu đang ở nước ngoài nên không thể thăm khám ạ , rất mong bác sĩ chỉ bảo và hướng dẫn cải thiện","Chào bạn! Cảm ơn bạn đã gửi câu hỏi đến eDoctor! Vấn đề xuất tinh sớm cần thăm khám để đánh giá và tìm hiểu nguyên nhân bạn nhé, bạn nên liên hệ với bs để bs đánh giá và có phương pháp cho bạn, ngoài ra bạn có thể tham khảo về chế độ tập luyện, các phương pháp cải thiện tâm lý và các tư thế hỗ trợ để có thể kéo dài thời gian ân ái bằng các sách có bán trên thị trường. Trân trọng"
29,Chủ đề nổi bật,https://edoctor.io/hoi-dap/tram-cam-qua-khu-dan-den-benh-tam-ly-nang-nao-trong-tuong-lai-khong,"Em xin chào,
Em năm nay 22 tuổi, thời gian gần đây (khoảng 5 tháng) em thấy mình sau 1 ngày làm việc hay mệt mỏi, kiệt sức về tinh thần lẫn sức khỏe và đôi lúc tự nhiên thấy hoang mang, lo lắng về mọi thứ xung quanh. 
Em từng bị trầm cảm nhẹ (chưa được chẩn đoán) cỡ hơn 3 năm, từng có ý định tự tử nhưng sau đó đã thoát ra được. (thời gian đó em mới nghỉ học, gia đình xảy ra chuyện, luôn thấy bản thân đang gánh vác mọi thứ,...)

Cho em hỏi, từ giai đoạn trầm cảm xảy ra trong quá khứ cùng với những biểu hiện gần đây có phải em đang mắc bệnh tâm lý nào đó không ạ?
Và em có cần thăm khám không? Nếu cần em phải khám chuyên khoa nào và cần chuẩn bị những gì?

Em cám ơn bác sĩ.","Chào bạn! Cảm ơn bạn đã gửi câu hỏi đến eDoctor! Vấn đề của bạn có nhiều yếu tố như cảm giác mất năng lượng, mệt mỏi vô cớ, lo lắng.... có thể chưa đủ tiêu chuẩn chẩn đoán bệnh lý tuy nhiên cần đánh giá sớm, bạn nên đi khám chuyên khoa tâm thần bạn nhé! Trân trọng"
